headline,guardian_keywords,esg_category
"After the Uber ruling, there's no excuse for government not to enforce workers' rights | Jason Moyers-Lee ","['work & careers', 'employment law']",social
The Golden Globe's sister act subverted the conversations that take place about celebrity women  ,['gender'],social
Short film discovery may be first Spanish talkie made by woman ,['gender'],social
All-women shortlists are seen as terrifying. But so is the status quo ,['gender'],social
"China in darkest period for human rights since Tiananmen, says rights group ",['human rights'],social
Sustainable development must prioritise women's sexual health ,['gender'],social
Jacob Blake: father refuses to ‘play politics with my son’s life’ amid furor over Trump visit ,['race'],social
"Flybe pensions at risk for 1,350 workers and ex-staff ",['job losses'],social
Google settled racism case from contractor 'treated like a terrorist' ,"['discrimination at work', 'race']",social
San Francisco's Chinatown reckons with Atlanta attacks: 'I don't feel safe anywhere' ,['race'],social
"Office makeover: 'If you can work anywhere, where do you want to work?' ",['work & careers'],social
Is a woman too old to have a baby at 50? It depends on who she is | Cari Rosen ,['gender'],social
Cambridge University exhibition celebrates black graduates ,['race'],social
Janet Yellen: first female Fed chair and economics trailblazer faces Trump's ax ,['gender'],social
Widen the remit of Black History Month | Letter ,['race'],social
QPR urge Uefa to act strongly over racist abuse in under-18 game in Spain ,['race'],social
Rise of #MeTooBots: scientists develop AI to detect harassment in emails ,['work & careers'],social
Steph McGovern: ‘Why I'm running a job clinic on daytime TV' ,['work & careers'],social
Football fans may need to take the lead in tackling racism at grounds | Letters ,['race'],social
Journey to work a daily grind? How to make your commute more productive ,['work & careers'],social
"'The beach is a human right': burkinis, black people and the threat of 'other' ",['race'],social
Statue of former California governor Pete Wilson removed in San Diego ,['lgbt rights'],social
Row as lesbian group asked to leave National Theatre bar ,['lgbt rights'],social
Why 'half-educated' Laurence Fox is back after his Question Time fiasco ,['race'],social
Tenors change 'O Canada' lyric to 'All Lives Matter' during MLB All-Star Game ,['race'],social
Publisher cancels tour of Jeanine Cummins' controversial novel American Dirt over safety concerns ,['race'],social
Recruitment of black and Asian judges too slow – lord chief justice ,['race'],social
The best slogans for remainers to chant | Letters ,['work & careers'],social
Warsaw equality parade expected to draw record turnout ,['lgbt rights'],social
‘I believe everything we are fighting for is possible’: young activists talk tactics ,"['race', 'gender']",social
The man who was caged in a zoo | Pamela Newkirk ,['race'],social
"Dear black NFL players, don't let yourselves be silenced | Kara Brown ",['race'],social
‘Most of the time they put you in a scarf’ – why black actors struggle in the hair-and-makeup chair  ,['race'],social
You can’t justify the gender pay gap. But the Alan Partridge types will try | Peter Bradshaw ,['gender'],social
UK students: what impact is coronavirus having on your chosen career? ,['work & careers'],social
Iran and Pakistan fuel surge in executions to 25-year high ,['human rights'],social
Sarah Champion: Labour's 'floppy left' falls silent when issues touch on race ,['race'],social
Somali refugee in critical condition after setting herself alight on Nauru ,['human rights'],social
We Ugandans are used to lockdowns and poor healthcare. But we’re terrified ,['human rights'],social
Bafta report blames homogenised culture and 'class ceiling' for lack of diversity ,['race'],social
Former UK ministers urge Obama to free Shaker Aamer from Guantánamo Bay ,['human rights'],social
Sean Spicer accused of racism after Indian American woman confronts him ,['race'],social
Racism is creeping back into mainstream science – we have to stop it | Angela Saini ,['race'],social
Housing ban on asylum seekers gives the far right a veto on where they live | Kenan Malik ,['race'],social
"I’m working class, the son of a refugee … and a Conservative. Here’s why | Mahyar Tousi ",['race'],social
What if men had periods? It’s a question still worth posing | Rose George ,['gender'],social
"The global plight of domestic workers: few rights, little freedom, frequent abuse ",['human rights'],social
"Will women be equal to men in 100 years? | Margaret Atwood, Lola Okolosie, Polly Toynbee, Athene Donald and Julie Bindel ",['gender'],social
Morocco acquits girls on trial for homosexuality ,['lgbt rights'],social
"Encourage teenagers to get Saturday jobs, says minister ",['work & careers'],social
"Police losing legitimacy among people of colour, top officers say ",['race'],social
"More refineries will follow Coryton into administration, says Essar Oil UK chief",['job losses'],social
Memphis citizens cheer overnight removal of two Confederate statues ,['race'],social
Daniel Kitson can’t reclaim a racist word he’s never been the target of | Nosheen Iqbal ,['race'],social
Secret Teacher: I'm my school's go-to gay guy ,['lgbt rights'],social
Boris Johnson’s white privilege: imagine he was a black woman | Gary Younge ,['race'],social
"Australian owner axes 1,400 jobs at Yorkshire and Clydesdale banks",['job losses'],social
Rail freight group DB Cargo to shed 900 UK jobs,['job losses'],social
"Secret Teacher: my school cares about our workload, others should too ",['work & careers'],social
"Nokia to cut 10,000 jobs worldwide to bankroll new 5G drive ",['job losses'],social
Mother of black man killed by Dallas officer ponders role of race in shooting ,['race'],social
Employers can't foot £400m care worker back pay bill. Government must act - fast | Derek Lewis ,"['work & careers', 'employment law']",social
It's not just London that has a housing crisis ,['work & careers'],social
Anti-racist book sales surge in US and Britain after George Floyd killing ,['race'],social
It's time for universities to make race equality a priority | Valerie Amos ,"['race', 'discrimination at work', 'work & careers']",social
Getting rid of Zuma isn’t a panacea for all South Africa’s ills | Benjamin Fogel and Sean Jacobs ,['race'],social
Azealia Banks axed from UK festival after racist rant at Zayn Malik ,"['race', 'lgbt rights']",social
Nearly 800 reports of people defrauding UK furlough scheme,"['job losses', 'work & careers']",social
South African woman jailed in landmark ruling for racist rant ,['race'],social
Middlesbrough condemn 'vile' racist abuse directed to Yannick Bolasie ,['race'],social
"Mass surveillance is fundamental threat to human rights, says European report ",['human rights'],social
New Covid variant and looming Brexit disruption deepen UK economic gloom ,['job losses'],social
Irish PM brings partner to meet Mike Pence and delivers pointed remarks on sexuality ,['lgbt rights'],social
Leroy Logan: the man who risked everything to fight racism in the police force – from within ,['race'],social
Has a disability affected your career? Share your workplace experiences ,['work & careers'],social
"Racism, protest and a dangerous president | Letters ",['race'],social
We need to revive the revolutionary spirit of the Pan-African Congress | Kehinde Andrews ,['race'],social
'White guilt on its own won't fix racism': decolonising Britain's schools ,['race'],social
British Steel: Turkish pension fund likely to be preferred bidder,['job losses'],social
Uber says its business is similar to a minicab firm ,['work & careers'],social
Law firm 'cocked-up' over list revealing Iraqi abuse claimants were not civilians ,['human rights'],social
Trump White House continues to neglect Spanish speakers ,['race'],social
Ferguson: more arrests as police and protesters clash for second night  (Scott Olson/Getty) ,['race'],social
A former hunger striker writes: help give Nazanin Zaghari-Ratcliffe hope | Letters ,['human rights'],social
Sheffield universities investigate four allegations of racism ,['race'],social
A 'straight-acting' problem: why mass market gay films increasingly fail us all ,['lgbt rights'],social
Hundreds of UK care workers threaten walkout over wage cuts ,['employment law'],social
"Psychologist Philip Zimbardo: ‘Boys risk becoming addicted to porn, video games and Ritalin’ ",['gender'],social
"Monsoon Accessorize on the brink, putting 3,500 jobs at risk",['job losses'],social
There’s nothing good about the rise in zero-hours contracts – ban them now | Peter Fleming ,['work & careers'],social
Hamilton star accuses London blues bar of racial profiling ,['race'],social
How to ace online job application forms ,['work & careers'],social
"Ford to cut 12,000 jobs in Europe amid struggling car market",['job losses'],social
"Assertive sexuality – yet again, we must fight the politicisation of sex
 ",['lgbt rights'],social
‘Turn back this wave of hate’: 100 writers call for an end to anti-Asian hostility ,['race'],social
Can international law meet the challenges of today's conflicts? ,['human rights'],social
London council saves gay fetish club from redevelopment ,['lgbt rights'],social
12 Rules for Life: An Antidote to Chaos by Jordan B Peterson – digested read ,['gender'],social
FA will take commonsense approach to players taking a knee in matches ,['race'],social
Terminally ill UK man launches legal challenge for right to die ,['human rights'],social
Breonna Taylor: grand jury testimony reveals police did not search her home ,['race'],social
Fay Weldon writes transgender sequel to feminist classic ,['gender'],social
"A £3,500 women-only island retreat is not empowering – it is elitist | Arwa Mahdawi ",['gender'],social
'These are our rights': The paralegals training to defend Ghana's LGBT community  ,"['lgbt rights', 'human rights']",social
"Teachers experience more stress than other workers, study shows ",['work & careers'],social
Gay women get a rough deal when it comes to fertility treatment | Shelley Silas ,['lgbt rights'],social
Corbyn needs to defend Labour MPs fighting antisemitism | Jonathan Goldstein and Jonathan Arkush ,['race'],social
"I dislike the link to empire, but it felt wrong to turn down an OBE | David Olusoga ",['race'],social
Italy passes watered-down bill recognising same-sex civil unions ,['lgbt rights'],social
Revealed: women making clothes for west face sexual abuse ,['human rights'],social
Diane Abbott may be flawed. But this is bullying | Gaby Hinsliff ,['race'],social
Grangemouth union to meet Ineos in bid to save petrochemicals plant,['job losses'],social
Diageo to cut 900 jobs in Scotland,['job losses'],social
Have you ever worked for BHS? Share your experiences ,['work & careers'],social
Independent newspaper group to axe jobs,['job losses'],social
Experience: my dog underwent gender reassignment surgery ,['gender'],social
Cameron announces plan to tackle hate crime after vote to leave EU ,['race'],social
"Power, and why sexual relationships in politics are so problematic | Kate Maltby ",['gender'],social
"Rees-Mogg plays Rule, Britannia! in Commons to celebrate Proms U-turn ",['race'],social
The Divided States: Trump's inauguration and how democracy has failed ,['race'],social
"Child marriage in Niger is a cultural issue, not an Islamic one ",['gender'],social
Audio file revives calls for inquiry into massacre of Iran political prisoners ,['human rights'],social
"Unemployment, job creation and the precariat","['job losses', 'work & careers']",social
Rodrigo Duterte says Obama 'can go to hell' and considers breaking up with US ,['human rights'],social
Police investigate racist abuse of mayor over removal of Brexit flags ,['race'],social
Historic England to relist Oscar Wilde's home and others with gay heritage ,['lgbt rights'],social
"If you can’t see antisemitism, it’s time to open your eyes | Michael Seagalov ",['race'],social
David Simon calls Baltimore police 'an army of occupation' ,['race'],social
"Rule, Britannia! is out of tune with the times ",['race'],social
"Changes to withdrawal bill threaten workers' rights, says Lisa Nandy ",['employment law'],social
Germany passes gender quota legislation for the boardroom ,['gender'],social
"Emergence of populist leaders threatens democracy, says Human Rights Watch ",['human rights'],social
Zoolander 2 screenwriter 'hurt' by transgender petition ,['lgbt rights'],social
"Bombardier: 1,400 Derby jobs are gone four months after PM's pledge to help",['job losses'],social
May Day: thousands across US demand racial justice at rallies for workers' rights ,['race'],social
I wasn't afraid. I took a stand in Baton Rouge because enough is enough | Ieshia Evans ,['race'],social
"Life in solitary: 'I can't see the sun rise, or the moon at night' ",['human rights'],social
British Library explores changing attitudes to gay love in exhibition ,['lgbt rights'],social
Working from home: share your experiences ,['work & careers'],social
Why are cases of Covid in the workplace not being reported in the UK? | Alice Martin ,['work & careers'],social
"We'll hire 100 black interns a year, say UK fund managers ","['work & careers', 'discrimination at work', 'race']",social
New Black Panthers documentary tells the story behind the berets ,['race'],social
The return of the virus which never went away. Whose fault isn't it? | First Dog on the Moon ,['race'],social
As a gay officer I saw how homophobic the police are | Kevin Maxwell ,"['lgbt rights', 'discrimination at work']",social
"Kiley Reid: ‘Some black women say: ""I don’t want to explain anything."" I’m not one of them' ",['race'],social
FC St Pauli: how it became the football team of punk and techno ,['race'],social
NSW coroner criticises 'inadequate' care given to Tane Chatfield prior to his death in custody ,['race'],social
Outrage greets Mexican feminism panel with 11 participants – all of them male ,['gender'],social
Trump rallies: where supporters get their pumped-up kicks from his bellicosity ,['race'],social
#killallwhitemen row: charges dropped against student diversity officer ,"['race', 'gender']",social
Ava DuVernay backs 'DuVernay test' to monitor racial diversity in Hollywood ,['race'],social
How to fight racism using science ,['race'],social
Tampon tax: women's charities urge for cash to be ringfenced ,['gender'],social
Why cancer is more deadly if you're black | Celine Gounder ,['race'],social
The Guardian view on Amazon: not a normal monopoly | Editorial ,['employment law'],social
"Printing money, a new national youth corps… time to think the unthinkable",['job losses'],social
HMRC staff braced for thousands of job cuts as 137 tax offices to close,['job losses'],social
Explosion outside Colorado NAACP building may be hate crime says FBI ,['race'],social
"Don’t hijack her murder, Alice Gross parents tell anti-immigration groups ",['human rights'],social
What are your biggest career regrets? Share your stories ,['work & careers'],social
UK weapons sales to oppressive regimes top $3bn a year ,['human rights'],social
Gender pay gap figures show eight in 10 UK firms pay men more than women ,"['gender pay gap', 'gender', 'work & careers']",social
British arms exports to Saudi Arabia to be scrutinised in high court ,['human rights'],social
"How many work emails is too many?
 ",['work & careers'],social
"UK wrong to deny transgender woman pension at 60, court rules ","['human rights', 'gender', 'work & careers']",social
Kingfisher's big catch,['job losses'],social
What to wear at the office Christmas party – AKA the fashion quandary of the year ,['work & careers'],social
Home Office faces legal battle over Prevent reviewer ,['human rights'],social
Thousands gather in London for George Floyd protest ,['race'],social
"Gold price increases lead to rise in abortions of baby girls in India, study finds ",['gender'],social
The Guardian view on Burma’s president: wanting it both ways | Editorial ,['human rights'],social
LGBT lessons row teacher leads Birmingham Pride ,['lgbt rights'],social
New Jersey judges rules 'gay conversion therapy' is consumer fraud ,['lgbt rights'],social
"Barclays to shed up to 1,000 jobs",['job losses'],social
Terrified of public speaking? Start with what you really want to say ,"['gender', 'work & careers']",social
'No one is listening to them.' Meet the former white supremacist helping police engage with extremists ,['race'],social
"Hollywood still excludes women, ethnic minorities, LGBT and disabled people, says report ","['race', 'lgbt rights']",social
I understand why an intern would live in a tent | Rhiannon Lucy Cosslett ,['work & careers'],social
Row over use of unpaid interns by Serpentine pavilion architect ,['work & careers'],social
Listen to the young voices of the Black Lives Matter movement | Letters ,['race'],social
Labour calls for second round of support for struggling firms ,['job losses'],social
Fears for City jobs as downturn in trading hits UBS and Deutsche Bank,['job losses'],social
Power and prejudice: why white people turn a blind eye to racism ,['race'],social
Boris Johnson adviser quits over race and eugenics controversy ,['race'],social
At last men are joining our conversation about toxic masculinity | Rhiannon Lucy Cosslett ,['gender'],social
"'We need a call to action': Stacey Cunningham, the NYSE's first female president ",['gender'],social
Covid-19 slashes UK car output to level last seen in 1954,['job losses'],social
Aretha Franklin’s voice ripped and caressed ... and liberated black girls like me | Candace Allen ,['race'],social
"A secret romance: the director who is confronting Nazis, race and bigotry ",['race'],social
"Turkish marriage law a blow to women's rights, say activists ",['human rights'],social
Zora Neale Hurston study of last survivor of US slave trade to be published ,['race'],social
"Neo-Nazis, white nationalists, and internet trolls: who's who in the far right ",['race'],social
How to get a job ,['work & careers'],social
Jobs fear as Axminster Carpets faces collapse,['job losses'],social
'I see things differently': James Damore on his autism and the Google memo ,['gender'],social
Teenager Moise Kean looking to take responsibility at Everton ,['race'],social
"Working people need fairer share of economic gains, says TUC head ",['work & careers'],social
Rude work colleague? They’re probably sleep-deprived | Paul Kelley ,['work & careers'],social
"Refugees in Greece suffering after EU deal with Turkey, say NGOs ",['human rights'],social
Guatemalan soldiers face civil war sexual slavery charges in historic trial ,"['human rights', 'gender']",social
How can the UK overcome a national skills shortage? Think local ,['work & careers'],social
A-level and #GCSE results: career options for #schoolleavers – join our live chat 1-2.30pm today #alevelresults ,['work & careers'],social
Sexists are scared of Mad Max because it is a call to dismantle patriarchies | Jessica Valenti ,['gender'],social
"Racists in Paris present depressing image of Chelsea, football and Britain | David Conn ",['race'],social
Almost 900 construction workers sacked over oil refinery strike,['job losses'],social
David Miranda in fresh challenge over Heathrow detention ,['human rights'],social
"Hey, Love Island, jump into the 21st century – the same-sex action is lovely ",['lgbt rights'],social
A Trump campaign chair in Ohio says there was 'no racism' before Obama ,['race'],social
'It was making me ill': experiences of sexual harassment at work ,['work & careers'],social
The arguments against the Human Rights Act are coming. They will be false | Keir Starmer ,['human rights'],social
A helping hand with childcare: options to make your child and wallet happy ,['work & careers'],social
MPs attack Kraft as irresponsible and cynical over Cadbury takeover,['job losses'],social
"Is it ever OK to ghost your job – to leave work one day and never go back?
 ",['work & careers'],social
"Britain’s political modernisers have been crushed, and their replacements have no vision | John Harris ",['work & careers'],social
"St Louis's top prosecutor sues city, citing law used to fight the KKK ",['race'],social
"Sell my flat, meet my ex? I get by with a little emailing from my friends | Keren Levy ",['work & careers'],social
All Day Long: a Portrait of Britain at Work review – is our labour really working? ,['work & careers'],social
'We only shoot black people': Georgia officer faces investigation for comment ,['race'],social
Anti-racism charities condemn online abuse of Wright and Agbonlahor ,['race'],social
Amazon supplier in China ‘will tackle illegal work practices’ ,['human rights'],social
Andrew Miller obituary ,['employment law'],social
We won’t tackle racism until anti-racist voices are given a fair hearing | Miriam Walker-Khan ,['race'],social
Guilt over household chores is 'harming working women's health' ,['gender'],social
How you can tackle discrimination at work | Guardian Careers | The Guardian ,"['work & careers', 'discrimination at work']",social
Johnson’s cabinet may be diverse but it doesn’t reflect modern Britain | Kenan Malik ,['race'],social
New York mother dies after raising alarm on hospital neglect ,['race'],social
The Guardian view on China and the Uighurs: everyone’s business ,['human rights'],social
Italy's Matteo Salvini says 'little ethnic shops' should close by 9pm ,['race'],social
"Islamic State has killed at least 30 people for sodomy, UN told ",['lgbt rights'],social
Worried a robot will replace you? Treat AI as an opportunity ,['work & careers'],social
Northern Ireland’s politics is fixated on the past – but young people want change | Kylie Noble ,['lgbt rights'],social
Anti-gay marriage video by US pressure group CatholicVote plays victim card  ,['lgbt rights'],social
'If black shoot them': former Kentucky acting police chief instructed a recruit ,['race'],social
"After Weinstein, our trauma has turned to rage. Let's use it | Steph Harmon ",['gender'],social
Israel: 'Some NGOs are seen as the enemy from the inside' ,['human rights'],social
Lynching memorial leaves some quietly seething: 'Let sleeping dogs lie' ,['race'],social
"Childcare crisis risks pushing women out of workforce, says TUC ","['work & careers', 'gender', 'gender pay gap']",social
"Racism literally ages black Americans faster, according to our 25-year study | Sierra Carter ",['race'],social
Andrew Lloyd Webber warns of diversity crisis in British theatre ,['race'],social
UK company to introduce 'period policy' for female staff ,['work & careers'],social
Ocean's 8 stars blame dominance of male critics for film's mixed reviews ,['gender'],social
'Tone deaf' ads use slave ship images to promote UK sea-going sector ,['race'],social
"Neo-Nazi logo linked to map of murders, says German MP ",['race'],social
Watchdog asks DWP for 'objective and impartial' sanctions statements ,['work & careers'],social
Women set up rival in reaction to male-dominated northern powerhouse event ,['gender'],social
Has the right learned to love higher wages? Don’t fall for it | Polly Toynbee ,['work & careers'],social
HSBC cuts threaten thousands of jobs,['job losses'],social
A Starbucks arrest shows how black Americans are robbed of their power | Rochaun Meadows-Fernandez ,['race'],social
Pope Francis's first Africa visit: what should be on his agenda? ,['lgbt rights'],social
"A Waco week, as Corbynistas do politics in the paranoid style | Marina Hyde ",['race'],social
New-builds suited to working from home | Letters ,['work & careers'],social
Do feminists need newsletters? ,['gender'],social
Russell Norman: ‘It’s 20 years since I was a chef. I still wake up in a cold sweat’ ,['work & careers'],social
'I couldn’t crack up': Nauru opposition MP recounts his dramatic escape to New Zealand ,['human rights'],social
Ta-Nehisi Coates's Black Panther is a hopeful first step for diversity at Marvel ,['race'],social
Men accused of killing British tourists in Thailand refused access to Met report ,['human rights'],social
Disabled women see #MeToo and think: what about us? | Anne Wafula Strike ,['gender'],social
Tories are now kowtowing on Windrush. It doesn’t fool us | Hugh Muir ,['race'],social
Think Boris Johnson is toxic to voters? Don’t be so sure | Gaby Hinsliff ,['gender'],social
Airbnb: how US civil rights laws allow racial discrimination on the site ,['race'],social
Extending the UK furlough alone isn't enough to save UK plc in 2021,['job losses'],social
America still hasn’t built racial justice in the years post-Selma | Steven W Thrasher ,['race'],social
How different would North Korea have been under Kim Jong-nam? ,['human rights'],social
'Gayropa': challenges and hopes of Europe's LGBT+ refugees – in pictures ,['lgbt rights'],social
"Heckles, jabs, coded insults: Florida's battle for governor exposes bitter racial divide ",['race'],social
Olaseni Lewis died in part from 'disproportionate use of force' ,['race'],social
Woman who defied 300 neo-Nazis at Swedish rally speaks of anger  ,['race'],social
Diversity fan zone blocked from opening in St Petersburg ,['lgbt rights'],social
"Republicans more likely to view Muslim Americans negatively, study finds ",['race'],social
Fox to make same-sex marriage movie based on landmark ruling ,['lgbt rights'],social
Oscars host Chris Rock overcomes nerves to tackle diversity row – and makes it funny ,['race'],social
A divided Britain is not new. So why do today’s schisms seem intractable? | Kenan Malik ,['race'],social
St Kevin's college apologises over students' sexist chant on Melbourne tram ,['gender'],social
Texas officer in pool party incident was sued over alleged racial profiling in 2007 ,['race'],social
