headline,guardian_keywords,esg_category
Kate Pickett and Richard Wilkinson: ‘Inequality strikes at our health and happiness’ | Dawn Foster ,['work & careers'],social
"Sajid Javid review could lead to business department axing 4,000 staff jobs ",['job losses'],social
Forced marriage: ‘I broke the chain. I’m proud of that’ ,['gender'],social
Roger Scruton’s brand of conservatism became a licence for bigotry | Jonathan Portes ,['race'],social
Vince Cable urges GM to save Ellesmere Port factory,['job losses'],social
"Afghanistan, domestic violence and divorce: one woman's harrowing story ",['gender'],social
We took down the Laura Kuenssberg petition to show sexist bullies can’t win | David Babbs ,['gender'],social
"Barclays profits fall, hit by £1bn PPI bill",['job losses'],social
Dior’s fragrance ad draws criticism for featuring Native American tropes ,['race'],social
Fears for Manchester's LGBT hub as cranes swing in ,['lgbt rights'],social
UK Mail driver who was unable to work after car accident charged £800 ,['employment law'],social
The downsides of work email now outweigh the benefits | Cary Cooper ,['work & careers'],social
France squandered the unity of its last World Cup win. This time must be different | Iman Amrani ,['race'],social
Romney wants Confederate flag taken down but other Republicans hedge bets ,['race'],social
Why I’m no longer talking to white people about race ,['race'],social
Google criticised for failing to remove antisemitic Auschwitz reviews ,['race'],social
How racist is Australia really? Let's ask the Xenophobitron 5000! | First Dog on the Moon ,['race'],social
What three decades in journalism taught me about the persistence of racism in the US | Howard French ,['race'],social
Ukip urged to cut ties with Christian group over gay ‘depravity’ comments ,['lgbt rights'],social
'I could so easily have died': Wretch 32's father on being shot with Taser ,['race'],social
Landlords and staff are entitled to be angry at House of Fraser,['job losses'],social
Chancellor under pressure to boost financial support as job crisis looms ,['job losses'],social
Minister decries Millwall fans who booed players for taking a knee ,['race'],social
Dressed As a Girl review – Hi-NRG birds of paradise perform ,['gender'],social
Council of Europe votes to maintain Russia's membership ,['human rights'],social
The psychology of a workplace bully ,['work & careers'],social
Britain moves towards part-time work culture in wake of recession,"['job losses', 'work & careers']",social
Labour MPs challenge Corbyn on antisemitism and Brexit ,['race'],social
Millennial news site Mic sacks most of its staff in New York,['job losses'],social
"Only 16 of world's highest-paid celebrities are women, Forbes finds ",['gender'],social
It is only a matter of time before we turn on the unvaccinated | Nick Cohen ,['race'],social
Booksellers remove racist and Holocaust denial titles from their websites ,['race'],social
Leaked report says racism and inequality increase Covid-19 risk for minorities ,['race'],social
Microsoft Japan tested a four-day work week. Productivity jumped by 40% ,['work & careers'],social
"Another day, another reason to be elated by congresswoman Alexandria Ocasio-Cortez ",['race'],social
Race hate crimes reported on UK railways rise 37% in five years ,['race'],social
Bruce Springsteen pulls out of North Carolina concert over anti-LGBT law ,['lgbt rights'],social
Rainbow flag to fly over Tate Britain to mark first queer British art show ,['lgbt rights'],social
"El Paso shooting: suspect confessed to attack targeting Mexicans, officials say ",['race'],social
Does club culture have a problem with bigotry? ,['race'],social
Windrush victims still waiting for payments from Home Office ,['race'],social
Today’s anti-trans rhetoric looks a lot like old-school homophobia | Shon Faye ,['lgbt rights'],social
Sorry to Bother You review – white privilege gets a wacky wake-up call ,['race'],social
Sexual harassment at work: more than half of claims in US result in no charge ,"['discrimination at work', 'gender']",social
UK economy's Covid catchup may take years despite signs of cheer ,['job losses'],social
Former detainees call for inquiry into UK role in torture and jailing ,['human rights'],social
Trump trans troops move pulls supreme court further into political mire ,['lgbt rights'],social
My Conservative party is losing touch with black Britain | Wilfred Emmanuel-Jones ,['race'],social
‘Even mourning is said to shame China’: women of Wuhan fight to be heard ,['human rights'],social
Donald Trump refuses to condemn white supremacists at presidential debate ,['race'],social
White clicktivism: why are some Americans woke online but not in real life? ,['race'],social
Has Boris Johnson made a calculated gamble to ignore LGBT voters? | Jonathan Cooper ,['lgbt rights'],social
All MPs should now see why grabbing someone’s knee is a problem | Caroline Lucas ,['gender'],social
Workers from poorer backgrounds face class earnings penalty – study ,['work & careers'],social
Football seems to be on the receiving end of a hateful double whammy ,['race'],social
UK's only trans philosophy professor to JK Rowling: Harry Potter helped me become a woman ,['lgbt rights'],social
Don’t Touch My Hair by Emma Dabiri review – groundbreaking ,['race'],social
"Republic collapses into administration – putting 2,500 jobs at risk","['job losses', 'work & careers']",social
Bus driver suspended for refusing to drive bus with rainbow number ,['lgbt rights'],social
Homosexual pardon delayed as officials say it could benefit paedophiles ,['lgbt rights'],social
"Low-paid should receive inflation-only rises, say business leaders ",['work & careers'],social
Court rejects bid to prevent Southern train drivers' industrial action ,['human rights'],social
Backlash after the Nation apologises for publishing controversial poem ,['race'],social
Australia urged to adopt plan to fight 'resurgence of racism' ,"['race', 'human rights']",social
"Sultan of Brunei, who passed anti-LGBT laws, owns slew of luxury UK properties ",['lgbt rights'],social
My beautiful commute: share pictures of your journeys to work ,['work & careers'],social
Truckers threaten new fuel price chaos,['job losses'],social
Q&amp;A: the legal significance of Magna Carta ,['human rights'],social
Number of minority arts workers must improve – Arts Council England ,['race'],social
'I saw hell': under fire inside Libya's refugee detention centres ,['human rights'],social
"Antisemitism has no place on the left. It is time to confront it, says @OwenJones84  ",['race'],social
How do you deal with mental health issues at work? Share your tips ,['work & careers'],social
Widow sues DPD over courier husband's death ,"['employment law', 'work & careers']",social
"Corporate jet taboo forces Bombardier to shed 3,000 jobs",['job losses'],social
Moroccan gay men to be tried for violating 'public modesty' over photo ,['lgbt rights'],social
I’ve been made a manager for the first time – what do I do? ,['work & careers'],social
"When women sign off emails as men, doors open. It's like magic! | Jamie Peck ",['gender'],social
Redcar steel plant goes into liquidation ,['job losses'],social
Read all about it ... five ways to kickstart a career in media ,['work & careers'],social
Chelsea invite racism victim to Stamford Bridge as José Mourinho admits shame ,['race'],social
Gender equality in science: it takes a village | @GrrlScientist ,['gender'],social
UK digital skills shortage risks Covid recovery as young people shun IT courses ,['work & careers'],social
"What’s in a name, women ask | Letters ",['gender'],social
Hope turns to despair as Egypt arrests witnesses to alleged 2014 gang rape ,['human rights'],social
The war against rap: censoring drill may seem radical but it's not new ,['race'],social
‘There was a period when virtually all brown characters were terrorists’ ,['race'],social
Andy Burnham: men convicted for being gay should get automatic pardons ,['lgbt rights'],social
Cheap razors are great but what if you’re a hairy woman who doesn’t shop in Tesco? ,['gender'],social
Parents in the arts need to stage a childcare revolution ,['work & careers'],social
For Muslim women life had been getting better. No longer | Yasmin Alibhai-Brown ,"['race', 'gender']",social
How has the Brexit vote affected the economy? April verdict ,['job losses'],social
Anne Enright: 'I've never been good with authority' ,['gender'],social
The recent mass shootings in the US all have one thing in common: misogyny | Jessica Valenti ,['gender'],social
Unemployment rate at record low despite stall in private sector hiring ,['work & careers'],social
"Militant group publishes global hitlist of bloggers, activists and writers ",['human rights'],social
Texas gay marriage ban blocked ,['lgbt rights'],social
Queer As Folk to get American reboot ,['lgbt rights'],social
Ford's planned job cuts highlight car industry malaise,['job losses'],social
Is your work-life balance going down the toilet? Share your stories with @GuardianCareers ,['work & careers'],social
Best believe the worst in this tale of two systems,['job losses'],social
Thousands of jobs at risk as dairy co-op collapses,['job losses'],social
South Africa judge rules police murdered anti-apartheid activist in 1971 ,['race'],social
"Black immigrants much more likely to be deported over criminal offenses, data shows ",['race'],social
"Black teen 'humiliated' after school colored his hair with marker, parents say ",['race'],social
What insurance is best for a self-employed decorator? ,['work & careers'],social
G4S migrant workers 'forced to pay millions' in illegal fees for jobs ,"['work & careers', 'human rights']",social
Being a man used to be easy... not any more. How to be a man in 2015 ,['gender'],social
Transgender woman moved from men's to women's prison ,['gender'],social
Has being on a zero-hours contract affected your health? ,['work & careers'],social
Families ‘facing hardest period in five decades’ as Britain's economy stalls ,['job losses'],social
Boys will be girls: Charles Jeffrey gets sporty at LFW ,['gender'],social
Big investors join list of heavyweights against North Carolina 'bathroom bill' ,['lgbt rights'],social
'She will be stronger': How Serena Williams can make the mother of comebacks ,['gender'],social
"From India and Turkey to Oxford, we live in a perpetual state of war against women | Suzanne Moore ",['gender'],social
America is optimistic about jobs in 2015 despite stubbornly low wages ,['job losses'],social
Family of man held in Ethiopia urges UK to do more to secure his release ,['human rights'],social
Home Office gives man asylum after accepting people can be gay and single ,['lgbt rights'],social
A suffragist statue in Parliament Square would write Emmeline Pankhurst out of history | June Purvis ,['gender'],social
Ken Livingstone blames 'embittered MPs' for row over Hitler remarks ,['race'],social
A surprisingly difficult question for Facebook: Do I have boobs now?  ,['lgbt rights'],social
"Deutsche Bank slashes 7,000 jobs, with City likely to take hit",['job losses'],social
"Charlottesville residents recall horror of car attack: 'Bodies writhing, blood everywhere' ",['race'],social
On board: Operation Black Vote battle bus makes stop in registration drive ,['race'],social
Vaccine hesitancy in some health workers in England 'may undermine rollout' ,['race'],social
Jamie Oliver's Fifteen Cornwall closes with the loss of 100 jobs ,['job losses'],social
Ban on criminal history question for US job applicants reveals deeper issue: racism ,['race'],social
Is western media an unwitting ally of North Korea's propaganda?  via @GuardianNK ,['human rights'],social
"Schaston Hodge, black man killed by white Texas troopers, was shot 16 times ",['race'],social
"More than 1,500 jobs at risk at Virgin Media and retail group Calvetron ",['job losses'],social
Gay rights campaigner accuses police of failing to link east London deaths ,['lgbt rights'],social
David de Gea’s transfer fiasco: another great admin error of our time ,['work & careers'],social
UK unemployment falls for first time in Covid-19 pandemic,['job losses'],social
How to do the most work in the shortest time | Mark McCartney ,['work & careers'],social
White supremacist group the Base uses terror to spread its ideology and recruit young men. The FBI is closely watching them – and the Guardian is now able to reveal the identity of its secretive leader ,['race'],social
My working week: 'A 999 caller is hiding from someone with a shotgun' ,['work & careers'],social
Women with learning disabilities are hidden victims of domestic violence ,['gender'],social
Distracted in the office? Blame evolution ,['work & careers'],social
Gender reassignment treatments for young people to get expert review ,['gender'],social
MPs fear rise in Islamophobia as mosques in England reopen ,['race'],social
IBM pulls #HackAHairDryer campaign admitting it 'missed the mark'  ,['gender'],social
Trans birth certificate campaign turns to other states after Victoria passes reform ,['lgbt rights'],social
How to master tricky conversations at work  ,['work & careers'],social
Covid-19 job losses sees record numbers seeking temporary work ,['job losses'],social
I'm angry. You're angry. All women are angry. But will that be enough? | Jean Hannah Edelstein ,['gender'],social
Natalie Diaz: 'It is an important and dangerous time for language' ,['race'],social
Victory on employment tribunal fees: this is what justice feels like | Jason Moyer-Lee ,['work & careers'],social
Ida B Wells: the unsung heroine of the civil rights movement ,['race'],social
China puts human rights activists on trial ,['human rights'],social
Construction firms apologise in court over blacklist ,['work & careers'],social
"African American men living in poverty face highest mortality risk, study says ","['race', 'gender']",social
India to review ruling on law criminalising homosexuality ,['lgbt rights'],social
I walked 170 miles to the RNC to talk to Trump supporters. They surprised me ,['race'],social
"John Lewis shuts eight stores with expected loss of 1,300 jobs",['job losses'],social
Texas to pass bill banning transgender students from choosing bathrooms ,['lgbt rights'],social
Why Trump can’t disavow the Charlottesville neo-Nazi carnage | Matthew d’Ancona ,['race'],social
Human rights lawyer to investigate Scottish police use of stop and search ,['human rights'],social
Scottish parties again face pressure over women and black election candidates ,"['gender', 'race']",social
Virgin Money boss criticises US banks' failure to join gender equality charter ,['gender'],social
Free speech advocates question university response to racist chant ,['race'],social
Covid anxiety and intolerance rise together in Australia but the only way out is together | Ranjana Srivastava ,['race'],social
‘A town of love and peace’: El Pasoans support each other in wake of attack ,['race'],social
UK bosses set up IT systems to track Covid vaccine status of staff ,['work & careers'],social
Low-cut top or covered up – guess which one will get you that job? ,['work & careers'],social
Claims of 'non-stop cycle of torture' involving top officials in Ethiopian jail ,"['human rights', 'human rights']",social
Gender wage gap costs minority women more than $1m in some states ,['gender'],social
Baltimore Freddie Gray protests turn violent as police and crowds clash ,['race'],social
"If the left can woo back white voters, it would benefit everyone | Remi Adekoya ",['race'],social
"Another 1,200 Carillion workers are told they will keep their jobs",['job losses'],social
I'm straight - here's why I volunteer at Pride in London | Kariss Ainsworth ,['lgbt rights'],social
Sweden adds gender-neutral pronoun to dictionary ,['gender'],social
Has publishing really become more diverse? ,['race'],social
"Northern cities head list of UK's low-wage, high-welfare economies ",['work & careers'],social
Rafe Spall: 'Dieting is the opposite of sex!' ,['race'],social
Uber granted right to appeal against ruling on UK drivers' rights ,"['employment law', 'work & careers']",social
No 10 refuses to comment on PM's views of racial IQ ,['race'],social
Arthur Mitchell obituary ,['race'],social
The emotional burden of living in fear: a call for women's stories ,['gender'],social
Jewish group protests at 'scandalous' Nazi memorabilia auction in Germany ,['race'],social
Donald Trump appeals to black voters in attempt to offset dismal polling ,['race'],social
Javid refuses to condemn PM's slurs against Muslim women ,['race'],social
'It's only a phase': what not to say to LGBT pupils if they come out ,['lgbt rights'],social
De Blasio joins LGBT St Patrick's Day marchers in braving New York City snow ,['lgbt rights'],social
Citizens Advice training document 'propagated racist stereotypes' ,['race'],social
Dean Laidley: second Victorian police officer may be charged over leaked photos of ex-AFL coach ,['lgbt rights'],social
Coronavirus exposes how riddled Britain is with racial inequality | Omar Khan ,['race'],social
800m champion Caster Semenya could be forced to undertake hormone therapy for future Olympics ,['gender'],social
A Garrick Club member on why the vote to keep women out is sad rather than sexist ,['gender'],social
What I’m really thinking: the expat wife ,['work & careers'],social
Ultra-Orthodox Jewish sect's female driver ban 'unlawful and discriminatory' ,['gender'],social
Nurses have been invisible and undervalued for far too long ,"['gender', 'gender pay gap']",social
Don’t let OJ Simpson blind us to black victims of injustice | Natalie Moore ,['race'],social
Zoë Kravitz: ‘Why do stories happen to white people and everyone else is a punchline?’ ,['race'],social
"#JusticeForLiz: With this conviction, the Kenya we want is within reach ",['human rights'],social
Charlie Hebdo: a letter to my British friends ,['race'],social
"I’m trans, and I don’t care if we were ‘born this way’. Neither should you | Shon Faye ","['lgbt rights', 'gender']",social
How can the UN fight inequality when it doesn’t pay its interns? ,['work & careers'],social
How to charm with email etiquette ,['work & careers'],social
Is it ok to cry in the workplace? Dean Burnett ,['work & careers'],social
A new low in mansplaining – menopause as a metaphor for a failing economy | Catherine Bennett ,"['gender pay gap', 'gender']",social
US promotes gay rights at United Nations with Broadway musical visit ,['lgbt rights'],social
The Guardian view on the ‘yellowface’ casting row: classical music has a diversity problem | Editorial ,['race'],social
Young black people nine times more likely to be jailed than young white people – report ,['race'],social
What can ?Gil Scott-Heron ?teach Rupert Murdoch about blackness???  ,['race'],social
‘This is a huge step for us’: jubilation as Saudi women allowed to drive ,['gender'],social
"Denial, obfuscation, apathy: why it’s so hard to get Islamophobia on the political agenda | Miqdaad Versi ",['race'],social
Dynamo Kyiv stadium chief suggests segregating black fans to combat racism  via @guardian_sport,['race'],social
'I was leaving a shop and security stopped me. I was four': young people on why they are marching against racism ,['race'],social
Gender equality is not a ‘women’s issue’ – it’s good for men too | Julia Gillard | Opinion | The Guardian ,['gender'],social
The White Pube: meet the emoji-using art critics who hate art criticism ,['race'],social
Taylor Swift accused of racism in 'African colonial fantasy' video ,['race'],social
Lily Allen blasts 'offensive' X Factor contestant Honey G | Music | The Guardian ,['race'],social
Tory Islamophobia row: 15 suspended councillors quietly reinstated ,['race'],social
Model Hanne Gaby Odiele reveals she is intersex ,['gender'],social
'I'd bottom for Hillary' betrays gay culture's struggle for equality | Zach Stafford ,"['gender', 'lgbt rights']",social
The virus that stole Christmas: meet the Santas giving this season a miss ,['gender'],social
Thousands protest in Poland against rightwing government ,['human rights'],social
Readers recommend: songs about being a man or woman | Peter Kimpton ,['gender'],social
Leonard Woodley obituary ,['race'],social
Cohabiting couples fastest growing family type – ONS ,['lgbt rights'],social
Meghan Markle's wedding was a rousing celebration of blackness ,['race'],social
Redcar looks to rise from the ashes after steelworks blow,['job losses'],social
Todd Solondz: 'I have weak moral fibre. I wish I were stronger' ,['race'],social
How to sell grooming products to men? Plaid designs and pine scents | Krista Burton ,['gender'],social
Italian officials and German firm face legal action over Saudi arms sales ,['human rights'],social
Cultural appropriation in America can be audacious. Just look at the Ku Klux Klan | Michael W Twitty ,['race'],social
Working mothers are good for children – but the guilt trips will keep coming | Polly Toynbee ,['work & careers'],social
The tipping minefield: who actually pockets your cash? ,['work & careers'],social
Three ways for UK schools to improve their race relations now ,['race'],social
CV and job application spelling test – take our quiz ,['work & careers'],social
Manifestos fail to fix young jobseekers’ woes so we need steps that work| Martin Bright ,['work & careers'],social
Women's Equality party to fight for free childcare and equal parental leave ,['gender'],social
Another black teen killed by Cleveland police as mother asks: 'Why? What happened? ,['race'],social
Shamima Begum: Sajid Javid labelled ‘moral coward’ over baby death ,['human rights'],social
The Guardian view on the pandemic's impact on women: sound the alarm | Editorial ,"['work & careers', 'race']",social
Join a five-a-side team just to find work? Meritocracy really is on its last legs | Peter Fleming ,"['work & careers', 'employment law']",social
"We're suing to hold Trump accountable for 'treasonous acts', NAACP chief says ",['race'],social
W Kamau Bell: 'History will prove that I was right to interview Richard Spencer' ,['race'],social
Joanna Lumley won’t take shortage of ladies’ loos sitting down | Rebecca Nicholson ,['gender'],social
From Jeanette Winterson to John Irving: John Boyne on the best books about gay life ,['lgbt rights'],social
Woman alleges attack by white nationalists after Nashville rally ,['race'],social
Iran refuses to free student activist Bahareh Hedayat after six years in jail ,['human rights'],social
Sweep of arrests hits US neo-Nazi group connected to five murders ,['race'],social
Obama's reply to a trans woman proves LGBT advocacy stops at gay marriage ,['lgbt rights'],social
You can’t judge art on the basis of who reviews it | Catherine Shoard ,"['race', 'gender']",social
Stonewall and Primark criticised for Pride T-shirts made in Turkey ,['lgbt rights'],social
Exercise didn’t disappear with the Greeks and Romans | Letters ,['gender'],social
Cultural clash: the trouble with writing about the lives of others ,['race'],social
Furloughed ethnic minorities and young hit hardest by job losses ,"['job losses', 'race']",social
Nottingham Forest issue suspension over 'racist' posts aimed at Derby's Duane Holmes ,['race'],social
"Three-quarters of mothers now in work, figures reveal ",['work & careers'],social
"I love my job, but my boss is a real problem ",['work & careers'],social
HSBC boss John Flint resigns 'by mutual agreement' ,['job losses'],social
Uncovering the brutal truth about the British empire ,['human rights'],social
"With queer spaces closed due to Covid, I feel more disconnected than ever from who I am | Benjamin Riley ",['lgbt rights'],social
Black British authors top UK book charts in wake of BLM protests ,['race'],social
Career paths: how these apprentices from the 1990s reached the top ,['work & careers'],social
Julia Gillard's advice to Hillary Clinton: call out any sexism early ,['gender'],social
Anti-Nazi League founders call for new national campaign ,['race'],social
The movement to defund police has won historic victories across the US. What's next? ,['race'],social
Tech leaders say visa cap removal may not solve UK skills shortage,"['job losses', 'work & careers']",social
Monsoon Accessorize jobs at risk after decision to close joint shops,['job losses'],social
"New Look considers shutting 60 UK stores – 1,000 jobs at risk",['job losses'],social
UK house price boom will collapse once buyers lose their jobs,['job losses'],social
Why the four-day week could help solve Britain’s inequality problem | Aidan Harper ,"['work & careers', 'gender', 'gender pay gap']",social
"New year, new start: CV and cover letter advice for 2016 – live chat 1-3pm GMT today ",['work & careers'],social
Metropolitan police extend controversial spit hood trial across London ,['human rights'],social
Amazon to stop selling books that frame LGBTQ+ identities as mental illness ,['lgbt rights'],social
Harper's Bazaar Megan Thee Stallion cover sparks representation controversy ,['race'],social
"One in 3 UK workers are in the wrong job, ONS figures claim ",['work & careers'],social
Why do some men coerce sex? | Don Greif ,['gender'],social
Nicola Sturgeon speaks about her miscarriage at 40 ,['gender'],social
Kerry James Marshall named most influential contemporary artist ,['race'],social
Wanderlust: how to become a remote worker – live chat ,['work & careers'],social
"White nationalists? Alt-right? If you see a Nazi, say Nazi | Lindy West ",['race'],social
'Who knows what's around the corner?' Bolton and Crawley react to Sunak's plans ,['job losses'],social
The Good Agency wins major grant to boost diversity in publishing ,"['race', 'lgbt rights']",social
"Imagine if the Nazis ran Hollywood. If you’re Tim Allen, you don’t have to ",['race'],social
