headline,guardian_keywords,esg_category
People think I look like my girlfriend – but it's natural to desire your doppelganger | Arwa Mahdawi ,['race'],social
Facebook boycott grows as US campaigners urge European firms to act ,['race'],social
What I wish I could tell my boss: ‘I won't sacrifice my family for you anymore’ ,['work & careers'],social
Couriers on Britain's shopping addiction: 'Customers don't care as long as it's cheap' ,['work & careers'],social
Mowing Mona Lisa: 'I could be the only person doing this right now' ,['work & careers'],social
Boy Erased review – starry but drab gay conversion drama ,['lgbt rights'],social
Tasmania to offer apology and quash historical convictions relating to gay sex ,['lgbt rights'],social
The Guardian view on novelists: making day jobs pay | Editorial ,['work & careers'],social
"Why should a job advert make me think, ‘am I attractive enough’? | Poppy Noor ","['gender', 'employment law', 'race', 'work & careers']",social
Sheriff David Clarke is a dangerous bigot. He must be resisted at every turn | Patrisse Cullors ,['race'],social
"One post, 947 applicants: restaurant’s story reveals the depth of UK jobs crisis ",['work & careers'],social
Why has Labour run the risk of alienating progressive Jews? | Nick Cohen ,['race'],social
Unemployment of Europe's young people soars by 50%,['job losses'],social
Sexism is making women sick | Jessica Valenti ,['gender'],social
Most British citizens say EU nationals should be able to vote in UK ,['human rights'],social
Dressing attendants as Mile-High Barbies is just a last blast of sexism | Barbara Ellen ,['gender'],social
Is it ever healthy to think of your colleagues as your family? ,['work & careers'],social
Elliot Page: star of X-Men and Juno announces he is transgender ,"['lgbt rights', 'gender']",social
Brunei defends death by stoning for gay sex in letter to EU ,"['lgbt rights', 'human rights']",social
My life without gender: 'Strangers are desperate to know what genitalia I have' ,['gender'],social
Church of England to create bishop for minority ethnic community ,['race'],social
Brexit is a menace to society in Northern Ireland. Here’s why | Roy Greenlade ,['human rights'],social
UK government accused of discriminating against maternity leave-takers ,['work & careers'],social
Thousands in China watch as 10 people sentenced to death in sport stadium ,['human rights'],social
"UK became more middle class than working class in 2000, data shows ",['work & careers'],social
Arson attack on East Belfast nail salon thought to be work of racists ,['race'],social
The chicken shop knife-crime campaign would be funny if it wasn’t so tragic | Coco Khan ,['race'],social
What Super Tuesday revealed about black voters’ power and preferences ,['race'],social
Martin Luther King: how a rebel leader was lost to history ,['race'],social
Antisemitism on the left and Jeremy Corbyn | Letters ,['race'],social
10 ways you can tell if you’re a ‘feminazi’ | Laura Bates ,['gender'],social
Making a holiday work when running a small business ,['work & careers'],social
Embattled Chicago mayor Rahm Emanuel courts voters in race to avoid election runoff ,['race'],social
Do you sound gay? What our voices tell us – and what they don’t ,['lgbt rights'],social
Oscars 2016: expect five minute diversity speech as Quincy Jones confirmed as presenter ,['race'],social
The new hand signals bringing meetings to order  ,['work & careers'],social
Deliveroo workers' contracts ban access to employment tribunals ,"['employment law', 'work & careers']",social
What will the next female prime minister do for women's rights? ,"['human rights', 'gender']",social
"From the classroom to the world stage, human rights matter | Bella Sankey ",['human rights'],social
"Eritrea blighted by 'ruthless repression' and human rights violations, says UN ",['human rights'],social
Nick Clegg targets female vote as Lib Dems launch election campaign ,['gender'],social
Lloyds Banking Group begins a cull of Halifax counters,['job losses'],social
Black teenager on London charity cycle ride injured during ‘aggressive’ arrest ,['race'],social
Scared about your human rights after Brexit? You should be | Schona Jolly ,['human rights'],social
"The Oscars aren’t just so white, they’re also so straight | Christine Vachon ",['lgbt rights'],social
'Retrieving the bodies of people who have died tears firefighters apart' ,['work & careers'],social
Brazil's men helped to become better fathers to reduce gender violence ,['gender'],social
Postcards from London review – flight of fancy to Soho's gay past ,['lgbt rights'],social
Saudi court sentences poet to death for renouncing Islam ,['human rights'],social
Ulster Bank job losses expected,['job losses'],social
Calling women ‘love’ can be less endearment than insult | Flic Everett ,['gender'],social
Palestinian rights and the IHRA definition of antisemitism | Letter ,['race'],social
Fifa to introduce racism monitors as part of build-up to 2018 World Cup ,['race'],social
"Fujitsu to cut up to 1,800 UK jobs",['job losses'],social
"London's Black Cultural Archives get £200,000 stopgap funding for survival ",['race'],social
Public spending cuts: the companies affected,['job losses'],social
Oakland police investigate smashed statue of Breonna Taylor ,['race'],social
Shortest Way Home review: Pete Buttigieg as president in waiting ,['lgbt rights'],social
European parliament calls for investigation into 'Azerbaijani Laundromat' ,['human rights'],social
"Yes, there’s a major problem with rape prosecution. It’s not that women are lying | Julie Bindel ",['gender'],social
"Malcolm X was killed half a century ago, but his work lives on in us today, says @Lanre_Bakare ",['race'],social
'We need to cry out': Atlanta's Asian American community reacts to shootings ,['race'],social
"'Bringing people together': identity, racism and an Asian-Australian family ",['race'],social
Guerrilla review – an energised exposé of racist policing in 1970s Britain ,['race'],social
"PWR BTTM review – queer culture, sequins and sly wit ",['lgbt rights'],social
I’m glad I left Brexit Britain. My EU friends who didn’t are stuck in limbo | Oliver Imhof ,['human rights'],social
What the 2016 budget means for you ,['work & careers'],social
'Old-fashioned sketch comedy has a very white sensibility': the race row that rocked Cambridge Footlights ,['race'],social
New hourly living wage rate rises by up to 4% ,['work & careers'],social
My CEO raised a disciplinary action against me unfairly  ,['work & careers'],social
Daryush 'Roosh V' Valizadeh cancels neo-masculinist meetings over safety ,['gender'],social
At the mercy of gangmasters: the growing army of jobless,"['job losses', 'work & careers']",social
Nigel Walker: 'British sport is not institutionally racist. But we have turned a blind eye' | Sean Ingle ,['race'],social
'An ugly truth': British sports bodies admit failure to confront racism ,['race'],social
Trump victory spurs women to run for office across US: 'Our time is coming' ,['gender'],social
Campaign group to challenge UK over surrender of passwords at border control ,['human rights'],social
Gender-reveal stunts tell us more than we bargained for | Eva Wiseman ,['gender'],social
How to read a poker face: the art of deciphering microexpressions ,['work & careers'],social
Iranian woman who removed headscarf sentenced to two years ,['gender'],social
Mass unemployment feared despite Rishi Sunak's 'plan for jobs',['job losses'],social
"Electrolux blames recession for 3,000 job losses",['job losses'],social
Suicide rates fall after gay marriage legalised in Sweden and Denmark ,['lgbt rights'],social
Most Britons weren’t hostile to migrants | Letters ,['race'],social
'Coughing while Asian': living in fear as racism feeds off coronavirus panic ,['race'],social
Can the wave of female House candidates lead to a 'tsunami' of wins? ,['gender'],social
100 women on 100 years of voting ,"['gender', 'human rights']",social
Theresa May wants to do something positive for trans people – they need it | Roz Kaveney ,"['lgbt rights', 'gender']",social
Bank of England slavery apology is not enough | Letter ,['race'],social
Cineworld considering temporary closure of all its UK and US venues,['job losses'],social
"What I want to tell my boss: ‘You're ruled by money, not patient care’ ",['work & careers'],social
Princess Latifa: secret videos raise fears for ruler's daughter forcibly returned to Dubai ,['human rights'],social
Can India’s military veterans join the fight for women’s rights?  via @GuardianGDP,['gender'],social
"Women's prize for playwriting longlist is 'politically charged', say producers ",['gender'],social
Calls for redesign of royal honour over 'offensive' image ,['race'],social
Paul Gascoigne pleads guilty to racially aggravated offence  ,['race'],social
"British Airways plans to make up to 12,000 staff redundant",['job losses'],social
The Argonauts by Maggie Nelson review – a radical approach to genre and gender ,['gender'],social
Met chief admits institutional racism claims have 'some justification' ,['race'],social
Methodist church announces plan to split into pro- and anti-gay branches ,['lgbt rights'],social
Should Little Britain and The Simpsons change with the times? ,['race'],social
'I felt utterly harassed' – your stories of returning to work after parental leave ,['work & careers'],social
How David Cameron and Nigel Farage are making children fear immigration  via @guardiang2,['race'],social
Eric Holder's last days in office: 'We do need to change the law' on civil rights ,['race'],social
68% rotten: female critics outnumbered two to one by male counterparts ,['gender'],social
Overwhelmed at work? Six tips on how to beat stress in the workplace #StressAwarenessDay ,['work & careers'],social
"Smokers spend more time unemployed than non-smokers, study shows ",['work & careers'],social
Crowd cheers as Charlottesville takes down statue of Confederate soldier ,['race'],social
"100,000 back call to compensate women caught out by state pension rise ",['work & careers'],social
"Tata Steel expected to announce 1,200 job losses in UK ",['job losses'],social
Israeli women protest over domestic violence in nationwide strike ,['gender'],social
How a neo-Nazi turned Islamist flipped terror narratives upside down | Arwa Mahdawi ,['race'],social
"Making a demon of JK Rowling is a wretched sport, born of misogyny and resentment | Catherine Bennett ",['gender'],social
Stormzy pulls out of Austrian festival citing 'racial profiling' ,['race'],social
Unemployment: what the experts said,['job losses'],social
This generation of Tories is complacent about the blight of unemployment,"['work & careers', 'job losses']",social
I chose not to go to university – it was the best career decision I ever made ,['work & careers'],social
Pescara’s Sulley Muntari walks off after being booked for reporting racist abuse  via @guardian_sport,['race'],social
Human rights in Australia will become a political plaything without consensus | Fergal Davis ,['human rights'],social
Dominic Cummings’ actions damage public trust | Letters ,['work & careers'],social
"I, Daniel Blake is a realistic depiction of life on benefits. Isn’t it? | Frances Ryan ",['work & careers'],social
"Racial fear has infected US politics, former Obama adviser Axelrod says ",['race'],social
UK high streets shed 140k jobs this year with more to come – study ,['work & careers'],social
"As Italy’s first black minister, I suffered vile racist abuse. But this poison damages us all | Cécile Kyenge ",['race'],social
"Gender pay gap is widest during workers' 50s, analysis shows ","['work & careers', 'gender']",social
Zero-hours contracts offered to 'a quarter of all unemployed' ,['work & careers'],social
When the truth is the wrong answer to a child’s question | Emma Brockes ,['work & careers'],social
Why the Guardian is changing the language it uses to describe abortion bans ,['gender'],social
How Ashbourne was divided over 'racist' bust 'hidden by Tory councillor' ,['race'],social
"Whether it’s Ali G or Tina Fey, ironic racism just isn’t funny any more | Emma Brockes ",['race'],social
"Mrs, Ms or Miss: why do forms require women reveal their marital status? ",['gender'],social
'A human rights crisis': Amnesty urges US to get tough on gun violence ,['human rights'],social
"UK government urged to avoid fourth Covid lockdown after 67,000 retail jobs lost",['job losses'],social
Not so pretty: the high health cost of women's products ,['gender'],social
Fall in UK apprenticeships may force 'radical rethink' of policy ,['work & careers'],social
SBS suspends broadcasts from Chinese state-run channels over 'forced confessions' ,['human rights'],social
"Salma Hayek is right: compared with women, men are lazy and entitled | Julie Bindel ",['gender'],social
Government row over limiting free speech on university campuses ,['human rights'],social
I introduced fun to the lives of A&amp;E staff. The laughter was infectious ,['work & careers'],social
"New Statesman cover on being childless 'reinforces prejudice', says Sturgeon  ",['gender'],social
"Dylann Roof was 'cold and calculated' in Charleston shooting, prosecutor says ",['race'],social
Bullying in the voluntary sector: ‘I was effectively outed at work’ | Lynne Wallis ,['work & careers'],social
How Game of Thrones has got it in for people of colour ,['race'],social
'I'd love to see their parents' bank accounts': corona and comedy's class divide ,['job losses'],social
"Arms used by Yemen rebel militia were supplied by west, analysts find ","['human rights', 'human rights']",social
Fairview: the Pulitzer winner whose creator hopes it has a short shelf life ,['race'],social
Revealed: the terror and torment of Turkey's jailed journalists ,['human rights'],social
Chechen leader's Instagram closure 'led to revenge attacks' on NGO ,['human rights'],social
How long will Republicans stay silent about Trump? ,['race'],social
Plan for 'equal wages' law in Germany meets with strong industry opposition ,['gender'],social
When will we realise that without sick pay the ill must work? | Torsten Bell ,"['work & careers', 'employment law']",social
Is it acceptable to laugh at Donald Trump’s mushroom? ,['gender'],social
The LA rebellion: when black film-makers took on the world - and won  via @guardiang2,['race'],social
Russian lawyers accuse unlikely animal chums of 'gay propaganda' ,['lgbt rights'],social
Secret aid worker: sexual harassment and discrimination in the industry  via @GuardianGDP,['gender'],social
Belarus resumes executions after EU sanctions dropped ,['human rights'],social
Northern Ireland under pressure after Irish gay marriage referendum win ,['lgbt rights'],social
No convictions over 500 black and Asian deaths in custody ,['race'],social
'George Floyd happens every day': activists seek justice for police killings the media forgot ,['race'],social
How many more young black men will have to die like Rashan Charles? | Rebecca Omonira-Oyekanmi ,['race'],social
Brexit: flagship repeal bill launches but likely course still unclear ,['human rights'],social
Hillary Clinton: misogyny 'certainly' played a role in 2016 election loss ,['gender'],social
Simply Be and High &amp; Mighty owner to close all 20 UK stores,['job losses'],social
I Am Not Your Negro review – an astonishing portrait of James Baldwin's civil rights fight ,['race'],social
How to tell a shining knight of a lawyer from an ambulance chaser? ,['human rights'],social
May throws down gauntlet to successor over paternity leave ,"['employment law', 'work & careers', 'gender pay gap']",social
Outrage at Disney casting Jack Whitehall to play a gay character is misguided ,['lgbt rights'],social
Can't get to sleep? Advice for insomniac workers ,['work & careers'],social
Boy Scouts expected to relax ban on gay and lesbian troop leaders ,['lgbt rights'],social
"UK prison officers punching compliant inmates, report says ",['human rights'],social
Turkey needs a moderating friend in Brexiting Britain | Ibrahim Dugus ,['human rights'],social
"'It's not all anal sex': the German schools exploring love, equality and LGBT issues ",['lgbt rights'],social
"Graduate advice: apply for your dream job, even if you don't match the criteria ",['work & careers'],social
Tom Watson urges newspapers to boost number of female political journalists ,['gender'],social
Haggling puts privatisation plan for Royal Mail at risk,['job losses'],social
UK peer sparks outrage after calling Kamala Harris ‘the Indian’ ,['race'],social
Misogynoir: where racism and sexism meet ,['race'],social
Betsy DeVos hearing prompts fears for campus sexual assault protections ,['gender'],social
Black NHS staff more likely to be bullied than white colleagues ,['race'],social
Chris Bryant makes emotional Commons plea over gay pardon law ,['lgbt rights'],social
"Met carried out 22,000 searches on young black men during lockdown ",['race'],social
"Fears grow for 2,800 General Motors jobs at Ellesmere Port",['job losses'],social
Why health equality is the next goal for the Women’s Equality party | Hannah Peaker ,['gender'],social
Russian yoga fans alarmed at arrest of teacher under new law ,['human rights'],social
Human rights abuses in Bahrain cast shadow over £2m UK aid support ,['human rights'],social
Violent deaths of LGBT people in Brazil hits all-time high ,['lgbt rights'],social
Rand Paul stalls bill that would make lynching a federal hate crime ,['race'],social
In the driving seat: India's school for female taxi drivers ,['gender'],social
To shave or not to shave down there? I won't let porn trends decide | Alex MK ,['gender'],social
"As March Madness rolls on, so will the myths of Black athletic superiority ",['race'],social
"Jewish, Muslim and LGBT communities oppose hate-crime hotline plans ",['lgbt rights'],social
Want to make British democracy fairer? First make it easier to vote | Maya Goodfellow ,['human rights'],social
Consumer confidence rises,['job losses'],social
Don’t be fooled by Johnson’s ‘diverse’ cabinet. Tory racism hasn’t changed | Kehinde Andrews ,['race'],social
Tim Hunt's findings in lab disproved as stress expert says men cry more at work ,['gender'],social
"Jeff Sessions got the Bible wrong. We care for strangers, not rob their rights | Rev Dr Barber and Rev Dr Theoharis ",['race'],social
The love I felt for Cyrille Regis as the bigots stood beside me | Kenan Malik ,['race'],social
"Attica Locke: ‘When Trump was elected, overnight my book changed. I didn’t alter a word’ ",['race'],social
The Tories’ Islamophobia will not be stopped from within | Fiyaz Mughal ,['race'],social
"US police unions show lack of diversity in leadership, study finds ",['race'],social
Zurich insurance firm offers fully paid 'lockdown leave' in UK ,['work & careers'],social
Michelin to close factory in Northern Ireland ,['job losses'],social
Black authors don’t only write for white women | Dreda Say Mitchell ,['race'],social
Npower to cut 900 jobs as it predicts marked financial losses for 2019 ,['job losses'],social
"Mothercare to cease all UK trading with loss of 2,800 jobs",['job losses'],social
What does Theresa May's record as home secretary tell us? ,['human rights'],social
Labour's antisemitism row hampers its campaign in Barnet ,['race'],social
'I'm up for the fight': Chris Jackson to be first black scientist to give Christmas lecture ,['race'],social
"Pioneer pulls plug on 10,000 jobs",['job losses'],social
Kenyan police officers detained after killings of three men spark human rights outcry ,['human rights'],social
Women Deliver racism investigation verdict described as a 'slap in the face' ,['race'],social
How to save: Martin Lewis’s four top tips for putting money away ,['work & careers'],social
Soas students call for director to resign over use of N-word ,['race'],social
Five things to remember if you didn't get on a graduate scheme ,['work & careers'],social
Hamlet review – this fresh prince is fully and gloriously female ,['gender'],social
Can a #BlackLivesMatter Twitter bot support activism and silence trolls? | Jess Zimmerman ,['race'],social
Sexual harassment at work code of practice criticised as inadequate ,['employment law'],social
Rescuing refugees: 'You never get used to it – and that's a good thing' ,['work & careers'],social
Colson Whitehead: ‘To deal with this subject with the gravity it deserved was scary’ ,['race'],social
14 routes to better education in Pakistan  via @GuardianGDP,['gender'],social
"The big picture: Afghanistan’s largest state school for girls, Herat, 2009 ",['gender'],social
One in 10 employers still to report on gender pay gap ,"['gender pay gap', 'gender']",social
Hugh Grant defends Harry: 'The tabloids effectively murdered his mother' ,['race'],social
The African American voters at the heart of Doug Jones' Alabama victory  ,['race'],social
"Third of Britons believe Islam threatens British way of life, says report ",['race'],social
"Gender pay gap to remain for thousands, says Conservative MP ",['work & careers'],social
Police facing claims that senior officers knew about spying on Stephen Lawrence family ,['race'],social
Juneteenth Independence holiday: here's what you need to know ,['race'],social
Katy Perry describes how she tried to 'pray the gay away' as an adolescent ,['lgbt rights'],social
Christian charities preach helping the less fortunate – unless you're gay | Zach Stafford ,['lgbt rights'],social
The Guardian view on #NiUnaMenos: challenging misogyny and murder | Editorial ,['gender'],social
Fresh abuse claims from women picking Spain’s strawberries ,['race'],social
Protesters topple statue of Confederate president in Virginia ,['race'],social
Premier League backs LGBT rainbow laces campaign for weekend’s matches  via @guardian_sport,['lgbt rights'],social
Authors steer boys from toxic masculinity with gentler heroes ,['gender'],social
'PC culture' isn't about your freedom of speech. It's about our freedom to be offended | Jessica Valenti ,['gender'],social
"Religious services ban in England may have been illegal, judge rules ",['human rights'],social
"Extrovert character traits shaped by background, study finds ",['work & careers'],social
Obama: Democrats need 'universal language' to appeal to moderate voters ,['race'],social
How women are gaining ground in virtual reality ,['gender'],social
Hundreds of Bakkavor jobs at risk as Tesco axes mashed potato contract,['job losses'],social
Women in film: which female directors deserve an Oscar? ,['gender'],social
"Racism is a system of oppression, not a series of bloopers, says @garyyounge ",['race'],social
"Caster Semenya is ‘unquestionably a woman’, say her lawyers ",['gender'],social
Tim Farron admits he had Thatcher poster in his childhood bedroom ,['lgbt rights'],social
ICC has no jurisdiction to prosecute Isis despite 'crimes of unspeakable cruelty' ,['human rights'],social
Gui Minhai: doctors visit kidnapped Hong Kong bookseller in China ,['human rights'],social
Teacher targeted over LGBT work shortlisted for $1m global award ,['lgbt rights'],social
Tell us: how do you switch off from work? ,['work & careers'],social
'No gay promotion can be allowed': Uganda cancels pride events ,"['lgbt rights', 'gender']",social
David Greene: Condemning lawyers for doing their jobs is inherently dangerous ,"['race', 'human rights']",social
Sweatworking: like networking but sweatier | ,['work & careers'],social
"Ruth Davidson’s decision was personal, but her departure is a loss for all of us | Libby Brooks ",['gender'],social
How I learned to love working from home ,['work & careers'],social
UK government accused of lacking compassion for asylum seekers ,['race'],social
Utah judge orders baby taken away from married lesbian foster parents ,['lgbt rights'],social
Will the next UN secretary general be a woman? ,"['gender', 'human rights']",social
Are you being replaced? How to deal with maternity discrimination ,"['work & careers', 'discrimination at work']",social
"The Stansted 15 activists should be supported, not punished | Letters ",['human rights'],social
Activists call on world leaders to make gender equality pledge a reality  ,['gender'],social
Rally calls for Confederate flag's removal from South Carolina legislature grounds ,['race'],social
Uproar in Cowley as BMW confirms 850 job cuts at Mini factory,['job losses'],social
Hungary is making a mockery of EU values. It’s time to kick it out | Owen Jones ,['human rights'],social
National Portrait Gallery given series of images of famous black Britons ,['race'],social
Picasso or bust: why Fox and other puritans find his work so shocking ,['gender'],social
Assad has unleashed horror on Syria. The EU must not make a deal with him | Raed Al Saleh ,['human rights'],social
The collapse in apprenticeships was predicted. Now it’s happened | Hugh Muir ,['work & careers'],social
New York police used ‘spit hood’ on Black man who died of asphyxiation ,['race'],social
I'm happy to boycott Chick-fil-A – but that doesn't make Popeyes progressive | Rashad Robinson ,"['race', 'lgbt rights']",social
Binyavanga Wainaina obituary ,['lgbt rights'],social
Black Americans are less likely to be prescribed painkillers – why?  ,['race'],social
Firms are offered interns on half the minimum wage ,['work & careers'],social
There have been no successful prosecutions for deaths in British police custody since 1969 – here’s why ,['race'],social
Theresa May unveils statue of pioneering MP Nancy Astor ,['gender'],social
Why should work be a baby-free zone?  | Melanie Reynolds ,['work & careers'],social
"Dear liberals, don't assume people of colour will solve all your problems | Bhaskar Sunkara ",['race'],social
100 best nonfiction books: No 26 – Notes of a Native Son by James Baldwin (1955) ,['race'],social
