Date,headline,text
2022-03-23,Hedge Funds Split on Short Selling-Emissions Debate,"The hedge fund industry can’t agree on how short selling should affect the way it reports so-called financed emissions. Some managers argue that short selling  whereby an investor makes money if an asset such as an oil producer falls in value - - should be booked as negative CO2 emissions. Others say an oil company doesn’t suddenly emit less CO2 just because it’s being targeted by short sellersAs for the regulators, they aren’t providing much help to resolve the debateFinancial watchdogs in the U.S. and Asia haven’t really weighed in. And from Europe, some guidance is expected later this year, though it’s not clear whether that will explicitly address the confusion. In the meantime, firms are taking matters into their own hands"
2022-03-22,Barclays to Devote More Financing to Renewable Energy,Barclays plans to step up its financing of renewable energy as Russia’s war on Ukraine adds to the urgency of moving away from fossil fuels.
2022-03-21,JPMorgan Analyst Says Russia Prompts Strategy Rethink,"The arrival of war in Europe has some investment clients questioning whether money they’ve put toward environmental, social and governance goals is being well spent, according to the co-head of ESG equity research at JPMorgan Chase & Co. Russia’s invasion of Ukraine is a “pivotal” event not just for geopolitics, but also for the multitrillion dollar ESG investing industry, said Jean-Xavier Hecker, JPMorgan’s co-head of ESG equity researchHe says some ESG investors are starting to look at stocks that have done well because of the war, such as defense, and are wondering how much longer they’re willing to forgo those returnsThey see this as “a potential missed opportunity” that they “are starting to question,” Hecker said. That’s as more traditional ESG allocations have “been costing relative performance for several ESG funds,” he said"
2022-03-20,Is Market ‘Shakeout’ Coming for Sustainable Funds?,"After attracting trillions of dollars, the ESG fund industry is headed for a “shakeout” over the next five years, according to the man who coined the acronym. The finance sector has “sprinkled ESG fairy dust” on products that do little to account for environmental, social and governance risks, said Paul Clements-Hunt, adding that ESG funds in jeopardy include those that track benchmark indexes, some of which invested in Russia“Anybody who uses ESG, sustainability or green purely as a marketing device is really heading for trouble,” Clements-Hunt said. “You’ll see a developing queasiness from marketing departments where, perhaps, ESG funds aren’t all what they’re cracked up to be”The warning comes as Russia’s invasion of Ukraine exposes some of the dubious choices money managers selling ESG investments have made. Such funds held about $8.3 billion in Russian assets just before the war, including holdings in state-backed energy giants, as well as bonds sold by Vladimir Putin’s government"
2022-03-17,D.E. Shaws Pushes for Corporate Overhaul at Verisk,"D.E. Shaw is pressing Verisk Analytics Inc. to make changes, including selling off non-core businesses, in moves that it said would create $20 billion in value for shareholders.  New York-based D.E. Shaw said in a letter to Verisk’s board that it also wants more independent directors to be added to the board“The company has underperformed for a decade because of operational missteps, poor capital allocation, a misguided diversification strategy, and lack of sufficient oversight,” D.E. Shaw managing directors Edwin Jager and Michael O’Mary said in the letterIn the past, D.E. Shaw, which has about $60 billion of assets under management, has pressed for changes at companies including Exxon Mobil, Bunge Ltd., and Lowe’s Cos., among others"
2022-03-16,Carney’s Plan for Carbon Offsets Gets Scaled Back,"Former Bank of England Governor Mark Carney’s initiative to boost the market for carbon offsets is being scaled back following a fierce debate around whether the traded assets really help avert global warming. Carney and Standard Chartered CEO Bill Winters launched a bold project in 2020 to expand the controversial market for the financial instruments, which allow buyers to claim reduced greenhouse gas emissions often without making any changes to their own activityAbout 18 months later, the body is re- purposing its mission to tackle the criticism that offsets don’t represent real carbon reductionsWhile Carney initially predicted the total market may reach $100 billion by the end of this decade, the sector remains mired in confusion over the integrity of carbon removal projects and a lack of clarity over how global trading of them should functionThe new plan dubbed the Integrity Council for the Voluntary Carbon Market will focus on assuring the quality of offsets sold, said Annette Nazareth, co-chair of the governance body and a former head of the U.S. SEC.  Targets to increase the size of the market have been ditched, and Carney’s promise of a pilot market in early 2022 also has been scrapped, she said"
2022-03-15,Funds With Russian Bonds About to Get ‘Wake-Up Call’,"Some of the roughly $40 billion in Russian foreign-currency debt now at risk of default is being held by a group of ESG funds. The Article 8 funds  a category in Europe’s environmental, social and governance investing rules  hold about $800 million of bonds issued by the government of Vladimir Putin that have a coupon payment due this week,  data showThe current value of the bonds is likely to be just a fraction of the reported amounts, with no clear roadmap for how investors will be repaid. Like other creditors who financed Putin’s government, which is now 20 days into its war on Ukraine, the ESG funds face deep losses and a protracted legal process as debt markets head into uncharted territoryThough ESG funds represent a small share of the total, they’ve still helped “finance the build-up of a war chest in Russia since 2014,” said Sasja Beslik, author of “Where the Money Tree Grows,” who was recently hired by Denmark’s PFA pension fund. It’s “a brutal wake-up call”"
2022-03-14,Money Managers Steer Clear of China Stocks,"Fund managers are extremely leery of buying Chinese stocks as the country’s close ties to Russia, extreme Covid-19 curbs and lack of clarity on the end of regulatory crackdowns overwhelm the dip buying opportunity presented by the 75% plunge from their peak. Most investors interviewed by  are hesitant to dive into the weakness even as valuations slump to the lowest levels in more than a decade. Some are planning to hold on to their existing positions, but few are looking to add“We are still avoiding Chinese stocks,” said John Plassard, a director at Mirabaud & Cie, which sold its equity positions last year. “There are too many question marks”The Hang Seng China Enterprises Index closed down 7.2% Monday, the biggest drop since November 2008. The Hang Sang Tech Index tumbled 11% in its worst decline since the gauge was launched in July 2020, wiping out $2.1 trillion of value from a year-earlier peak"
2022-03-13,Banks Pull Out of Russia After Decades of Investment,"Thousands of staff, billions of dollars and three decades of complicated relationships. Some of the world’s largest banks are starting to pull back from Russia, but it’s not going to be easy. Goldman Sachs became the first to announce its withdrawal on Thursday, having already moved some Moscow-based staff to Dubai. JPMorgan followed suit, saying it is actively unwinding its Russia business and currently engaging in limited activities in the countryCitigroup’s roughly 3,000 workers in Russia give it by far the largest presence of any major U.S. bank in that country. It’s operating “on a more limited basis given current circumstances and obligations,” according to a statement Wednesday, and is continuing efforts to exit the business that began before the invasion of UkraineMeanwhile, Morgan Stanley is considering moving some of its 20-strong Russia-based team to the Gulf state and other financial centersDeutsche Bank is assessing options for its information technology hub in Russia and Commerzbank has “stopped doing new business” in the country"
2022-03-10,"Goldman, JPMorgan Are Joining the Exodus From Russia","Goldman Sachs said it plans to shut down operations in Russia and JPMorgan Chase said it’s actively unwinding its business in Moscow in response to the country’s invasion of Ukraine. Goldman said the investment bank is “winding down its business in Russia in compliance with regulatory and licensing requirements.” At the end of 2021, the firm’s total credit exposure to Russia was $650 million, most of which was tied to non-sovereign counterparties or borrowersIn a statement, JPMorgan said “current activities are limited, including helping global clients address and close out pre-existing obligations; managing their Russian-related risk; acting as a custodian to our clients; and taking care of our employees”The finance- industry giants join a growing list of companies, including McDonald’s and Coca-Cola, that have said they’ll halt business operations in Russia, as the death toll rises in Ukraine and millions of refugees flee	Meanwhile, Russia’s government is attempting to seize and even nationalize foreign-owned companies that are leaving the market and is planning measures to coax others into staying"
2022-03-09,"Like Russia, Funds Now Being Scolded for Myanmar Ties","Hundreds of ESG funds run by some of the world’s biggest money managers have a combined $13.4 billion stake in companies that supply weapons and technology to the Myanmar military. The funds, which say they take into account environmental, social and governance risks, have investments across 33 companies that the United Nations and two advocacy groups say provided weapons, communications and technologies to the military, Inclusive Development International and ALTSEAN-Burma saidThe report comes as investors, particularly in the ESG universe, face new questions about how they should approach armed conflicts. Roughly 14% of sustainable funds globally held Russian assets before the war began, an allocation that now looks questionable on principle and in practiceDavid Pred, executive director of Inclusive Development International, said there’s no place for arms manufacturers in ESG funds, “full stop”"
2022-03-08,Asia Hedge Fund Loads Up on European Defense Stocks,"A hedge fund manager famed for a $2.7 billion volatility trading gain during the global financial crisis is now looking at investment themes stemming from the Russian invasion of Ukraine. Stephen Diggle bought defense stocks, including BAE Systems, in anticipation of western Europe rearming itself“The risk-reward has shifted a lot in the past seven days,” said Diggle, who runs a family office in SingaporeThe Russian invasion has sent shock waves across markets, aggravating inflation concerns and threatening the global economic recovery from the pandemicAt the outset of the war, Diggle’s $300 million Vulpes Investment Management bought shares of Thales SA, the French aerospace, defense and security company, as well as BAE. It added to the bets after German Chancellor Olaf Scholz pledged Feb. 28 to ramp up military spending"
2022-03-07,The Corporate Exodus From Russia Turns Into Rout,"Netflix, TikTok, Samsung and credit-card operators have joined the lengthening list of businesses cutting ties with Russia or reviewing their operations in the country as reputational and financial risks mount. International sanctions, the closure of airspace and transports links due to the war, and the financial restrictions on SWIFT and capital controls have made it difficult if not impossible for many companies to supply parts, make payments and deliver goods to and from RussiaAdded to that, the potential international consumer backlash against any company perceived as helping Vladimir Putin’s regime means that the exodus of corporations from Russia has become a stampedeThe rout reverses three decades of investment there by foreign businesses after the Soviet Union broke apart in 1991Russia has vaulted past Iran and North Korea to become the world’s most-sanctioned nation in the span of just 10 days"
2022-03-06,Russian Invasion Puts Sustainable Funds at Crossroads,"An investing movement that promotes itself as a protector of people and the planet has somehow found itself providing capital to the autocratic regime behind Europe’s worst military conflict since World War II. Funds labeled ESG  an acronym that denotes a commitment to environmental, social and governance interests  own shares of Russia’s state-backed energy behemoths Gazprom and Rosneft, as well as its biggest lender Sberbank. The funds also hold Russian government bondsThese investors have provided money that ultimately helped pad the coffers of President Vladimir Putin’s autocracyPaul Clements-Hunt, who led a group that coined the term ESG back in the mid-2000s, said it’s now clear that “ESG investors have failed”“ESG is being used ineffectively,” said Clements-Hunt, founder of Blended Capital Group. Investors should be measuring risks across entire systems not just corporate risks, but instead, “the obsession with easy money- making is overriding everything,” he said."
2022-03-03,CORRECT: ESG DAILY: Exxon Takes Steps to End Russia Ties,"Exxon Mobil plans to terminate its decades-long relationship with Russia due to international sanctions and the nation’s “needless destruction” in Ukraine, said CEO Darren Woods. The process of ending operations before eventually exiting its stake in the Sakhalin-1 oil development will be “complicated” and require careful management, Woods saidThe asset is valued on Exxon’s books at about $4 billion and makes up 1% to 2% of earnings and capital employed“As the operator of Sakhalin-1, we have a significant responsibility to make sure that operation is run safely, and the integrity of the environmental performance and the operations itself is sound,” Woods said. Exxon will work with “our co-venturers” to habd the project over “successfully and without incident”"
2022-03-03,Fund Market Gets Another Test as Indexes Dump Russia,"Major index providers are officially cutting Russian assets from their gauges, ratcheting up the pressure on an ETF industry already facing an extraordinary stress test. MSCI and FTSE Russell have said they’re removing Russian equities from some of their widely-tracked indexes; Stoxx Ltd. also announced it will delete Russian companies from its benchmarks and close its country-specific gaugeFirms including S&P Dow Jones Indices and JPMorgan Chase are still consulting on the matter, with decisions expected soonThe moves further complicate the outlook for ETFs already suffering after sanctions and the Moscow market shutdown made their underlying assets virtually impossible to buy or sellU.S.-listed funds tracking Russian assets, including the iShares MSCI Russia Capped ETF (ticker ERUS) and the VanEck Russia ETF (RSX), slumped Thursday following the news, with several facing trading halts"
2022-03-01,"DWS Group, Abrdn Add to Investors’ Flight From Russia","DWS Group said its actively-managed mutual funds won’t make new investments in Russian securities. Abrdn said it won’t invest in Russia or Belarus for the foreseeable future, citing ESG-related concerns. BlackRock suspended the creation of new shares in an ETF tracking Russian stocks, one of a slew of issuers across Wall Street effectively halting inflows into products lashed by the fallout from the war in UkraineMore than a dozen funds managing at least $3 billion have been frozen as fallout from Russia’s invasion reverberates through the financial marketsPictet Asset Management and Amundi told investors they had suspended activities or restricted clients from accessing funds invested in Russian securitiesStorebrand said it will freeze all Russian investments and divest from RussiaIn addition, JPMorgan may revise its widely followed bond indexes as sanctions pile up against Russia, a step that could push investment funds that track the benchmarks to stop buying the underlying securitiesMSCI downgraded its ESG rating of Russia from BBB to B (the second-lowest rating) and Belarus’s from BB to B"
2022-02-28,"JPMorgan, Danske Bank Freeze Russia-Exposed Funds","JPMorgan Chase and Danske Bank are among the asset managers freezing funds with exposure to Russian equities. JPMorgan Asset Management said clients won’t be able to buy or redeem shares of its JPM Emerging Europe Equity fund or its Russia fundDanske Invest Management said it’s suspending trading in its Eastern European fund, while Liontrust Asset Management said it’s halting withdrawals and purchases of its Russia fund until further notice“Due to the escalating conflict between Russia and the Ukraine, local market trading conditions are not currently operating as they normally would do,” JPMorgan wrote in a letter to investors of the Emerging Europe fund. “We understand that being unable to deal in the fund is frustrating and we will take the decision to lift this suspension as soon as we consider it is in the best interests of existing shareholders to do so”"
2022-02-27,Buffett Gives Successor Space for Sustainability,"Warren Buffett built a rare excerpt into his much-awaited annual letter: A note from Greg Abel, his successor-in-chief at Berkshire Hathaway Inc. Abel, who was publicly identified as the successor to America’s most renowned investor for the first time last year, was tasked in Berkshire’s annual report Saturday with giving a breakdown of the firm’s sustainability endeavors  a sign of the topic’s rising importance to the conglomerate and its shareholdersBuffett, who has faced mounting pressure on environmental issues over the years, typically navigates the topic by referring back to Berkshire’s operating model, where each company has individual responsibility for how it addresses such risks. Abel’s letter marks one of the most comprehensive explanations of the firm’s environmental strategy in a Berkshire annual report yet, while also cementing his ascent to the top job as and when Buffett steps down“It has a tremendous signaling effect,” said Jim Shanahan, an analyst at Edward Jones. “It’s perhaps the first sign of a true transition at the helm here. He has tasked his successor with specifically commenting on their efforts  particularly as it relates to environmental issues and sustainability   I think it’s a powerful statement”"
2022-02-24,SEC Probing Stock Sales by Elon Musk and His Brother,"The Securities and Exchange Commission is investigating whether Tesla Inc. Chief Executive Officer Elon Musk and his brother Kimbal violated securities laws when selling shares in the company last year, according to a person familiar with the matter The regulator’s probe is focused on transactions late last year just before Elon Musk polled his Twitter followers asking if he should sell 10% of his stake in the company, prompting Tesla’s shares to tumbleThe investigation, reported earlier by The Wall Street Journal, is focusing on whether any insider trading rules were violated, said the person familiar with the matter"
2022-02-23,Solar Startup Tops Goldman Sachs With CEO Pay,"A solar-power startup little known outside the energy industry gave its chief executive a bigger pay package last year than banking giant Goldman Sachs Group Inc. lavished on its own leader.  Heliogen Inc., based in Pasadena, California, provided chief executive officer Bill T. Gross with compensation worth $37 million for 2021, according to a filing last month after it went public in late DecemberGross’s award, however, comes with a catch: It almost entirely consists of options that vest over four years and will be valueless unless he helps lift the company’s stock price“Those options aren’t worth a penny if the stock doesn’t go up,” said Steven Hall of executive compensation consulting firm Steven Hall & PartnersHeliogen and its investors are betting on a high-risk, high-reward corner of the energy market. The company uses AI to constantly adjust mirrors that focus sunlight on a small spot, generating heat that can top 1,000 degrees Celsius. It may be a way to cut fossil-fuel use  and carbon emissions  in heavy industries that require extreme heat, such as making steel and cement"
2022-02-22,Banks Approach SocGen to Manage Russia Transactions,"Wall Street banks are approaching Societe Generale SA to see if the French lender could help manage financial transactions involving Russia if the nation is hit with sanctions relating to the tensions over Ukraine. Speaking during an internal town hall with Asia Pacific staff on Friday, SocGen Chief Executive Officer Frederic Oudea said the firm has “large U.S. and international banks that are coming to us, to see whether we can do their business of clearing and corresponding banking for them”The Paris-based lender “may be one of the very few banks able to carry on transacting with the rest of the world” the CEO said at the town hall, a copy of which was obtained by , as part of wide-ranging responses to questions from staff that covered topics including SocGen’s business in Russia and how a conflict could bring Russia and China even closer.Oudea didn’t name the banks that reached out and didn’t indicate what services the bank would be willing or able to offer"
2022-02-21,Allianz Fires Fund Bosses After Multibillion Blowup,"Allianz SE dismissed two people responsible for managing a suite of hedge funds that allegedly lost investors billions of dollars and prompted probes by U.S. regulators. Greg Tournant and Stephen Bond-Nelson, who managed the Florida- based Structured Alpha hedge funds for Allianz Global Investors, were dismissed in December, regulatory filings show. A third manager involved in running the funds, Trevor Taylor, left at the same time, a person familiar with the matter saidTournant was “discharged for violation of firm policies designed to ensure compliance with industry regulations and standards relating to the preparation and provision of client communications,” while Bond-Nelson’s position was terminated for a “violation of firm compliance policies,” regulatory filings show. It isn’t clear why Taylor departedInvestors  including public pension fund Arkansas Teacher Retirement System and New York’s Metropolitan Transportation Authority  said they collectively lost billions of dollars from the collapse of the hedge funds, which were set up to profit from volatility yet incurred huge losses during the early days of the pandemic"
2022-02-20,Bets on China Green Stocks Drag Down Top Asia Funds,"Asia’s best-performing equity funds of last year have now tumbled to near the bottom of the pile as their bets on China’s green energy rally turn sour. Driving the underperformance are the funds’ holdings in China’s renewable energy and electric vehicles, whose shares have taken a beating after two years of scorching rallies following Beijing’s carbon neutrality goals. Even as China reaffirms its policy easing stance, monetary tightening elsewhere has pushed up global borrowing costs, spurring a rush out of frothy sharesThe five stock mutual funds that handed investors at least 30% in total returns last year have all posted losses of about 6% or more since the start of 2022, according to data compiled by . Last year’s star, First State Cinda New Energy Industry Equity Fund, has lost 11%, versus an average loss of 4.7% among the region’s $1 billion-plus peers“Valuation has more than reflected its growth potential in the near term,” said Hao Hong, chief strategist at Bocom International. The “mismatch between green ambition and the reality of near-term dependency on traditional energy” may suggest the latter will have better returns in the short run, he said"
2022-02-17,"U.S. Adds WeChat, AliExpress to Notorious List","The U.S. added Chinese messaging platform WeChat and online marketplace AliExpress to its list of notorious markets for counterfeiting and piracy, an annual compilation of the worst intellectual-property abusers and counterfeiters. Alibaba Group Holding Ltd.-owned AliExpress and Tencent Holdings Ltd.’s WeChat are “two significant China-based online markets that reportedly facilitate substantial trademark counterfeiting,” the Office of the U.S. Trade Representative said in a statement accompanying the release of the 2021 review ThursdayThe USTR first started publishing the annual standalone list in 2011 to increase public awareness and help market operators and governments prioritize intellectual-property enforcement efforts. The 2021 review identifies 42 online and 35 physical markets that are reported to engage in or facilitate substantial trademark counterfeiting or copyright piracyPinduoduo Inc., one of the largest online retailers in China, continues to be listed after first being included in 2019. Alibaba’s Taobao, together with Baidu Inc. cloud-storage service Baidu Wangpan and e-commerce service provider DHgate.com Inc. are also still on the list. Nine physical markets located within China that are known for the manufacture, distribution, and sale of counterfeit goods are included"
