Date,headline,text
2022-06-30,"EPA Isn’t ‘Knocked Out,’ But Its Job Just Got Harder","The US Supreme Court ruling that curtailed the Environmental Protection Agency’s flexibility to curb power-plant emissions on a systematic basis is setting the stage for a piecemeal approach to the issue. But the decision didn’t erase the agency’s ability to regulate greenhouse-gas pollutants more broadly, nor did it leave it entirely toothless in the fight against climate changeThe agency still maintains the ability to regulate emissions from individual power plants, but now must move forward with more caution. Even before the ruling, EPA officials were planning new rules to regulate plant emissions, taking a narrower approach that would be focused squarely on coal- and gas-fired power plants, without bringing in non-emitting renewable electricityNow it seems likely that the narrow approach will be the clearest path forward after the Supreme Court stripped the agency of broader oversightThe EPA can still force significant emission reductions, “but it will be more costly and less effective,” said Jay Duffy, an attorney with the Clean Air Task ForceRead more: Supreme Court Crimps Biden’s Climate Agenda With Limits on EPA"
2022-06-29,JPMorgan-Backed Data Firm Seeks $1 Billion Valuation,"Investors have long complained that there isn’t enough information about the non-financial risks facing companies in China and Southeast Asia. Environmental disclosures, for example, aren’t common, and where they do exist, they’re often inconsistent and unreliable.  A six-year-old data company backed by JPMorgan and GIC says it’s learning plenty about companies without waiting for regulators or required disclosuresMioTech scrapes information and statistics from thousands of government, regulatory and corporate sites across China and Southeast Asia to evaluate companies’ environmental, social and governance practices, including violations, pollution, carbon footprint and hiring discriminationNow MioTech’s parent company, Cayman-based Mioying Holdings, is in the process of raising about $150 million at a valuation of $1 billion, said co-founder and Chief Executive Officer Jason Tu"
2022-06-29,Stellantis Says EV Market Is at Risk Unless Costs Ebb,"Unless electric vehicles get cheaper, “the market will collapse,” said Stellantis Chief Manufacturing Officer Arnaud Deboeuf. Stellantis aims to reduce the costs of making EVs by 40% by 2030, Deboeuf saidThe producer of Fiats and Peugeots plans to manufacture some parts in-house and also pressure suppliers to cut the price of their productsDeboeuf’s comments follow Ford Motor CFO John Lawler, who said earlier this month that rising raw-materials costs are rendering some battery-powered models unprofitable"
2022-06-28,Credit Suisse’s Risk Chief Sees Room to Take Chances,"Credit Suisse’s new risk chief said the bank should consider taking more chances again, after two years of scandals and financial hits eroded its appetite for putting money to work. After the “catastrophic events” that culminated in billions of dollars in losses from the collapse of Archegos Capital Management and Greensill Capital, the “risk pendulum did swing a bit to the conservative side,” David Wildermuth said“I think we’re moving the pendulum back the other way,” he said. “And we have the capacity to increase our risk”The comments come as Credit Suisse seeks to transition from damage control and an almost complete management shakeup to a period of growth again"
2022-06-28,Fund Managers’ Popular Bet Has Lawyers Sounding Alarm,"One of the most popular corners of ESG is getting a bad name.  Article 8  a category within the EU’s anti-greenwash rulebook  is drawing criticism from lawyers for becoming a catch-all product that provides clients with little insight into how their cash is being usedFund managers will “just say we promote environmental and/or social characteristics, but won’t tell you what they are,” said Mikhaelle Schiappacasse, a partner at law firm Dechert LLP in London.  “And they won’t necessarily say how they measure what they’ve achieved”In order to comply with Article 8 requirements, fund managers “essentially need to say what characteristics they’re promoting, what indicators they’re using to measure sources of data,” she said. “That’s pretty much it. And to be honest, a lot of the products out there don’t even go that far”"
2022-06-28,Microsoft Investors Target Its Tax Practices,"Microsoft Corp., a staple of ESG investment funds, is being called out by a group of shareholders for what they say is its poor track record on tax transparency. Investors managing more than $350 billion in total filed a resolution demanding that Microsoft report in line with the Global Reporting Initiative Tax Standard, according to a statement from the group on Tuesday. The resolution also calls on Microsoft to disclose its tax and financial information on a country-by-country basis“Technology is a sector that has historically been characterized by tax avoidance, particularly for large multinationals like Microsoft,” said Katie Hepworth, responsible tax lead at Pensions & Investment Research Consultants Ltd., which coordinated the resolution. The risk of regulatory “investigation and intervention” is a particular concern for investors, Hepworth said in a statementThat’s as taxation becomes a hot topic in Europe, where officials have taken aim at complicated structures used by multinationals to reduce tax rates or drive them to zero. Lawmakers last month advanced a plan for a minimum corporate tax rate of 15% from 2023 for large firms, to implement a landmark agreement by 136 countries to stop luring companies with ever-lower tax rates"
2022-06-27,Wall Street’s Carbon Offsets See BP Pay a ‘Pittance’,"Oil giant BP has found a climate bargain in some of Mexico’s poorest areas, paying a fraction of market rate for carbon offsets to rural villagers working to protect their forests. The leaders of Coatitila, a village in eastern Mexico, thought in 2019 they’d found a way to protect the dwindling forests and bring a serious change to a local economy where the average person earns only $6.40 a day when they can find workOne of the world’s most prestigious climate nonprofits, the World Resources Institute, was helping run a program that pays villages to reforest their communally owned woods and improve forestry management. Participation would bring in cash from oil giant BP, which would ultimately purchase carbon credits that the villagers generated, along with further funding from a US government agencyAfter two years of work, the village got its first annual payment in late 2021. The pay, split among 133 members of the community, amounted to about $40 each  whereas the village leader hoped they could earn as much as $44,000 in total per year. The final sum was 30% lower and worth little more than a week’s work per person"
2022-06-27,Investors Want Europe Banks To Boost Board Diversity,"The boardrooms of European financial services companies are failing to meet investor expectations in terms of their gender balance and the technology and sustainability expertise they possess. Some 44% of investors said gender diversity played a part in their decision to buy a company’s shares, according to the poll of 300 money managers by professional services firm EYAbout half said sustainability experience was important and 54% said boards should have fintech experienceBut the importance shareholders place on such attributes doesn’t match current board composition, according to Omar Ali, financial services managing partner at EY for Europe, Middle East, India and Africa"
2022-06-27,‘Special’ Bonds Offer Option to Spur China Economy,"China’s government is cash-strapped with Covid-19, tax breaks and a property downturn pulling down income while spending keeps rising to pay for economic stimulus and containing virus outbreaks. One option Beijing has to fill the gap is to sell special sovereign bonds, a rarely used financing tool it last dusted off in 2020 to help lift the economy without inflating the budget deficitBefore that, they were employed during the Asian financial crisis in the 1990s and again to help seed China’s sovereign wealth fund in 2007"
2022-06-26,Hyundai Climbs the EV Sales Charts and Tesla Notices,"Pipe down for a second Elon Musk, the hottest things in the auto industry  the most electric electrics  now come from Hyundai Motor and Kia Corp. Earlier this year, the South Korean carmakers rolled out two new battery-powered cars  the Hyundai Ioniq 5 and its sibling, the Kia EV6  which promptly tore up the sales charts, passing the Nissan Leaf, Chevrolet Bolt and every other electric vehicle on the market not made by TeslaIn the US this year through May, Hyundai and Kia sold 21,467 of these two machines, besting even the white-hot Ford Mustang Mach-E, which was snapped up by 15,718 drivers“From an EV perspective, they’re really just kind of cleaning the floor,” said Edmunds analyst Joseph Yoon. “I honestly don’t know if any dealers around me have any in stock”"
2022-06-23,Investors Pull Money From ETFs Amid Wider Selloff,"Investors pulled money from ESG-labeled exchange-traded funds last week for the third time in the past seven weeks. The withdrawals are occurring amid a broader selloff in the financial markets, so it’s hard to read too much into investors’ longer-term perceptions about the outlook for ESGA net $177 million was redeemed from ETFs focused on environmental, social and governance factors last week, which isn’t much considering that even with the recent declines, almost $24 billion has poured into the funds since the start of the year, data compiled by  showAdditionally, the outflows aren’t much when compared with the $7.7 billion that exited equity funds and the $5.2 billion that left bond funds during the week ended June 8, the Investment Company Institute reported"
2022-06-23,Some Green Bonds May Lose Environmental Credentials,"A bunch of green bonds and loans may soon lose their environmental credentials under the European Union Taxonomy’s strict standards for green debt, according to NEF. Under EU Taxonomy regulation, debt must be assessed according to the specific activities it’s actually financing; and to be considered green, those activities must either align with the Taxonomy framework or help a company become alignedIn the energy and utility sectors, 86% of outstanding green bonds may struggle to demonstrate such an alignmentA potential solution would be to create an additional label for bonds issued prior to the Taxonomy that met alternative green criteria, such as the Green Bond Principles created by the International Capital Market Association (ICMA). However, this might still undermine the robustness of the EU Taxonomy"
2022-06-22,BlackBerry Investors Unite Against Major Shareholder,"Shareholders of BlackBerry Ltd. rebuked the board and major shareholder Prem Watsa, rejecting the company’s executive compensation plan and voting in large numbers against Watsa’s re-election as a director.  Watsa received just 50.7% support at the Canadian software company’s annual meeting on Wednesday. Excluding the 46.7 million shares controlled by Watsa’s Fairfax Financial Holdings Ltd., shareholders representing a majority of the votes at the meeting opposed him.BlackBerry investors also voted 56% against the company’s compensation plan in a so-called “say on pay” resolution. That was up from 41% opposition in a similar vote last year.BlackBerry shares remain lower than they were when John Chentook over as chief executive officer in 2013 with a plan to focus on software instead of smartphones."
2022-06-21,"Musk Sounds Off on Recession Risk, Twitter Deal","Elon Musk, the billionaire visionary and oftentimes erratic entrepreneur, struck a sober tone Tuesday as he forecast a probable recession in the US and left doubts about his commitment to a $44 billion takeover of Twitter. In an interview with  News Editor-in-Chief John Micklethwait at the Qatar Economic Forum in Doha, the Tesla CEO also said the electric-car maker’s workforce needs to be trimmed as supply-chain snarls crimp growthHe said he sees the US economy headed toward contraction. It’s just a question of when“A recession is inevitable at some point,” Musk saidRead more: Musk Says Bots Are a Problem for Twitter Deal, Not China"
2022-06-21,CORRECT: ESG DAILY: Nippon Steel Considers Coal Mine Investments,"Nippon Steel is prepared to make more investments in coal mines after the energy source surged in price, as Japan’s biggest steelmaker looks at ways to stabilize the supply of one of its key raw materials. International prices of coking coal, the variety shoveled into blast furnaces to manufacture the alloy, have spiked to unprecedented levels in the wake of Russia’s invasion of UkraineAt the same time, Japanese steel mills, most of which are reliant on imports, are grappling with ballooning costs after a dramatic slide in the value of the yenIt’s a dynamic that’s led Nippon Steel to study whether investing further in coal projects makes sense, particularly as miners come under pressure to divest those assets because of fears over global warming, said Kiichi Yamada, general manager of the company’s raw materials division"
2022-06-21,"Tesla Layoffs Violated Federal Law, Suit Says","Tesla Inc. was sued by some former employees who claim the company’s decision to lay off about 10% of its workforce violated federal law by failing to provide the required advance notice for the job cuts. Two workers fired this month from Tesla’s battery factory near Reno, Nevada, allege the company didn’t comply with the 60-day notification requirement under the Worker Adjustment and Retraining Notification ActJohn Lynch and Daxton Hartsfield, who worked at the plant for about five years, were among more than 500 employees at the facility that were let go, according to the suitThe two men claim neither was given any advance notice of the termination. They are seeking class-action status for their lawsuit on behalf of others who were part of mass layoffs in May and June"
2022-06-20,Funds Resist Worst of Downturn But Investors Spooked,"For sustainable investors browbeaten by the recent attacks on the industry, fund performance may offer a bit of reprieve.  In three broad categories — Europe-focused, US-focused and global — ESG equity funds have done better this year, on average, than their non-ESG counterparts. All are negative, in line with the broad market selloff, but ESG funds are down less than the others, in spite of typically tech-heavy, energy-light portfolios.ESG proponents insist that using environmental, social and governance metrics in investing decisions can drive returns — or at least won’t drag them downOthers aren’t so sure. The rapid growth in ESG funds coincided with a bull market that ended in 2022, making this lull a test for portfolio managers and investors alike"
2022-06-19,Volkswagen Faces Mounting Scrutiny Over Xinjiang,"Volkswagen faces mounting pressure to address allegations of human rights violations in the Chinese province of Xinjiang, where the German carmaker operates a car factory. While there’s no evidence that anyone has been mistreated at the VW plant, the company should carefully examine the accusations, said supervisory board members Joerg Hofmann, a labor leader, and Stephan Weil, who represents VW’s anchor shareholder Lower Saxony“We have to concretely weigh the facts and on this basis answer the question if a termination of the activity there would be the right thing,” Hofmann told the Braunschweiger Zeitung in an interview, citing potential damage to VW’s reputationVolkswagen has fielded uncomfortable questions about its suppliers and operations in Xinjiang, where human rights groups and a panel of United Nations experts have raised concerns about coercive labor practices. China has repeatedly rejected criticisms of the work programs, calling allegations of forced labor lies and defending its policies as an effort to reduce poverty and unemployment"
2022-06-16,Musk Says Twitter Users Deserve More Freedoms,"Elon Musk said Twitter should allow people to say “pretty outrageous things.” Tesla’s CEO made his comments Thursday during a gathering at Twitter, according to staff who participated in the virtual meetingIt marked the first time the billionaire has addressed Twitter employees since agreeing in late April to buy the company for $44 billionTwitter needs to allow more space for people to say whatever they want, Musk said, as long as it doesn’t violate the lawMusk said his goal is to expand Twitter’s base to 1 billion users. The company had about 229 million daily active users as of March"
2022-06-16,JPMorgan Manager Reveals Doubts About Loan Pitches,"There’s a corner of ESG that seems more prone to “greenwashing” than others and that’s the market for sustainability-linked loans, according to one of the JPMorgan Chase managers who helps sort through debt that’s pitched to the firm. The Wall Street giant, which is among the world’s top three underwriters of green bonds, is seeing a lack of consistency in the quality of the ESG loans that corporate clients are trying to get, according to Andre Abadie, managing director at JPMorgan’s Center for Carbon TransitionHe’s even gone on the record to say that a lot of the sustainability-linked loan pitches that cross his desk “aren’t really fit for purpose,” and describes the market as “a bit of a wild west”“My team evaluates ESG transactions that we as a firm are doing,” Abadie said in an interview. “We’re setting our own bars as to what we think is appropriate and acceptable”"
2022-06-15,Mitsubishi Estate Plans Novel Diversity Bond Sale,"Mitsubishi Estate, one of Japan’s biggest real estate developers, plans to sell a bond with part of the proceeds going to elevating women in its management ranks. The company wants to increase the proportion of female managers to 40% in fiscal 2050 from 5.8% in fiscal 2020Mitsubishi Estate said it’s considering issuing sustainability-linked notes with terms linked to variable targets like cutting emissions, as well as the diversity goalsThe bond would be the first of its kind in Japan that has both environmental and social-related goals in the same framework"
2022-06-14,China’s Reopening May Be Too Late for Some Developers,"China’s stop-start reopening may be too little, too late to save some cash-strapped property developers. Among 32 builders that have defaulted since the start of last year or are currently facing debt-repayment pressure, at least 13 have derived more than a third of their sales from the Yangtze River Delta area anchored by Shanghai“The lifting of lockdowns won’t necessarily provide an imminent relief to developers that have traditionally invested in the region,” said Amy Kam, a senior portfolio manager at Aviva Investors. “Unless funding channels are reopened, many private developers will continue to struggle to pay down debts with operating cash flow”"
2022-06-14,Activist Investors Pounce on Vulnerable UK Blue Chips,"Activists are back and UK Plc is their main target in Europe. Having given CEOs a pass in the depths of the Covid-19 pandemic, activist investors big and small are once more doing battle in the boardrooms of UK blue-chips. Since late May, A-lister Nelson Peltz has stirred fresh expectations of a revamp at consumer group Unilever, and up-and-comer Bluebell Capital Partners has renewed calls for reform at miner GlencoreThey’re among the agitators now ensconced in London-listed companies with a combined market value of about $500 billion, according to data compiled by  Intelligence. Their peers have landed everywhere from energy giant Shell to drugmaker GSK, and telecommunications provider Vodafone“If you look at performance out of the pandemic overall, they are lagging in their recovery,” Rich Thomas, head of European shareholder advisory at Lazard, said of UK companies. “Remember that activists are value investors first and foremost”"
2022-06-14,Breaking the Bank or the Law Is New Abortion Reality,"The 24 hours after Belle found out she was unexpectedly pregnant were a blur of phone calls, highways and panic. Her home state of Texas had recently outlawed the right to an abortion after around six weeks, leaving her just days to secure a procedure in a region where there’s a dearth of clinics. Belle and her husband didn’t want to risk her health with a pregnancy — she is diabetic — nor the economic stability they had worked so hard to build. So they raced to meet the new legal deadline, dialing clinics in-and-out of state, cashing in their savings, and driving through the night to get a scarce appointment on Christmas Day“It was overwhelming. There was no time to really think about it. You have to make a decision, right then and there,” said Belle, who is in her early 30s, speaking from her Dallas apartment in May. “I was just in such a rush to figure everything out”Should the Supreme Court overturn Roe v. Wade in coming weeks, as expected, Belle’s experiences are a harbinger of what’s to come across the US. Twenty-six American states are set to ban or severely restrict abortion if the landmark legislation is toppled, making access to the procedure even more difficult than it is already"
2022-06-13,Hedge Funds Get Short-Selling Assist From Trade Group,"Hedge funds eager to prove that short-selling is a legitimate ESG strategy just got some fresh material to back their case. A study published by the Managed Funds Association indicates that targeted short-selling campaigns may slash as much as $140 billion of capital expenditures from the biggest carbon emitters in the S&P 500 by pressing them to clean up their acts“While the role of short-selling in ESG has long been a topic of conversation, our paper provides quantitative evidence showcasing its impact on the cost of capital for a company and effectiveness as a tool for integrating ESG into a portfolio,” said Bryan Corbett, the MFA’s chief executiveBy contrast, a recent report from MSCI Inc. found limited evidence to back the claim that shorting raises capital costs, and questioned its value as an ESG strategy"
2022-06-12,Goldman Sachs Faces SEC Probe Over Marketing of Funds,"Goldman Sachs is facing an investigation by the US Securities and Exchange Commission to determine whether two of its mutual funds are in breach of ESG metrics promised in marketing materials, according to a person familiar with the matter. The SEC doesn’t yet have rules in place covering ESG requirements, so the probe may focus on whether Goldman’s disclosures to clients accurately describe its investment practices, according to the Wall Street Journal, which was first to report the examinationOfficials at the SEC and Goldman Sachs declined to comment, and the inquiry could end without formal enforcement actionRegulators in the US and Europe are increasingly digging into how firms package and market investments, looking at disclosure lapses and more-serious accusations of “greenwashing,” or overstating ESG capabilitiesRead more: ESG Fund Bosses Hit by ‘Reckoning’ as Goldman, DWS in Crosshairs"
2022-06-10,Buffett Faces Off Against Big Tech in Wind-Farm Fight,"Google, Facebook and Microsoft  three of the world’s biggest corporate buyers of clean power  are sounding the alarm that an almost $4 billion, Warren Buffett-backed renewable-energy project proposed in Iowa isn’t necessarily in the best interest of customers, including them. If approved, it would be the largest complex of wind farms in the entire country when it comes online by the end of 2024, producing enough electricity for more than 700,000 homesMidAmerican Energy, a utility owned by Buffett conglomerate Berkshire Hathaway Inc., has asked state regulators to approve terms including a guaranteed 11.25% rate of return before starting construction on a project it says will help in its efforts to trim carbon emissions by 75% compared to 2005 levelsBut the big-name tech giants that operate data centers in the state warn the project, dubbed Wind Prime, might drive up electricity costs. MidAmerican, they say, should consider alternatives"
2022-06-09,Wealthiest Green Entrepreneurs Lose $141 Billion,"Not long ago, demand for renewable energy, electric vehicles and all kinds of greener technologies was creating wealth beyond measure. Now the richest people in green sectors are seeing their billions evaporate.  The 15 groups of moguls on ’s “Green Billionaires” list, which includes the world’s richest person, Elon Musk, have seen their collective fortunes drop by $141 billion over the past seven months, wiping out roughly one-quarter of their net worthThe 15 biggest tech billionaires, a list that also includes Musk, have by comparison lost 23% of their worth, while the world’s top 500 richest tycoons have lost 14% of their wealth over the same period"
