Date,headline,text
2022-11-28,Top-Ranked Hedge Fund Makes Contrarian Bet on Meta,"As most techology stocks reel from higher interest rates and slowing growth, one top-performing hedge fund manager is going against the tide to bet on the sinking shares of Facebook-owner Meta Platforms. Expensive Silicon Valley tech wouldn’t normally feature on the shopping list for the Liontrust GF Tortoise Fund, which its manager Tom Morris describes as a “value-focused hedge fund,” seeking out shares it deems to be cheap“We are value managers but parts of tech are actually value stocks now,” said Morris, who co-manages the $600 million fund with Matthew SmithTortoise has outperformed 99% of its long-short equity fund peers this year, with returns of about 22%, compared with the 12% decline of the  Equity Long/Short Hedge Fund IndexNow though, Morris reckons it’s time to be “sensibly contrarian”	For perspective, Meta doesn’t rank among the 25 largest holdings of the $20.4 billion iShares ESG Aware MSCI USA ETFSeparately, Meta Platforms was slapped with a €265 million ($277 million) fine for failing to prevent the leak of personal data for more than half a billion users of its Facebook service"
2022-11-27,Deutsche Bank’s DWS CEO Mulls New Legal Setup,"DWS Group CEO Stefan Hoops is considering changing the firm’s legal structure as part of his effort to raise the appeal of the firm to a broader range of shareholders. One option for the head of Deutsche Bank’s asset-management arm is to switch the current setup, which curbs the influence of minority shareholders, into the German form equivalent to a UK PlcIt’s not clear whether Hoops plans to make reference the possible plan during a strategy update in two weekSHoops is conducting a broad review of DWS ahead of Dec. 7 where he will lay out his vision for the asset manager six months after taking over as CEO amid allegations of greenwashing under his predecessorThe appeal of DWS to clients and investors is a key consideration and he has questioned the strength of the DWS brand in regions outside Germany	Goldman Sachs’ ESG penalty from the SEC bodes well for Deutsche bank and DWS, according to analysts at  Intelligence"
2022-11-24,"JPMorgan, Deutsche Bank Sued by Epstein Accusers","JPMorgan Chase & Co. and Deutsche Bank AG were accused of enabling the sexual abuse perpetrated by Jeffrey Epstein in New York class action suits that allege the banks turned a blind eye in order to “churn profits.” The lawsuits, filed separately in a New York court, allege the banks had “knowingly benefited and received things of value for assisting, supporting, facilitating, and otherwise providing the most critical service for the Jeffrey Epstein sex trafficking organization”JPMorgan was accused in the suit of “financially benefiting from participating” in the alleged sex trafficking through providing financial support from 1998 to August 2013Deutsche Bank was accused of knowing that they would “earn million of dollars” from its relationship with EpsteinThe suits threaten to return the spotlight to Wall Street and the nature of its links to Epstein. A Who’s Who of prominent financiers, entrepreneurs, politicians and even royals have been tainted by their association with the convicted pedophile"
2022-11-23,Tech Job Cuts Increase ‘Anxiety’ Across Industry,"After years of exuberant growth and hiring, layoffs have burst the bubble of Silicon Valley inviolability. As of Nov. 15, tech companies had announced 31,200 job cuts so far this month, according to Challenger, Gray & ChristmasThe human-resources consulting firm says that’s the highest monthly total since September 2015, when a restructuring Hewlett-Packard said it would slash thousands of positionsMeta, Twitter and Amazon.com have all slashed their ranks, or said cuts are coming. HP said Tuesday it planned to cut as many as 6,000 positions over the next three years"
2022-11-22,"Amundi, DWS Reclassify Funds in Major Industry Reset","Amundi and Deutsche Bank’s DWS Group are downgrading billions of dollars worth of ESG funds, adding to the sense of disarray that’s spreading across Europe’s asset management industry as it digests stricter regulatory guidance. Amundi is reclassifying almost all funds listed under the EU’s top ESG category, known as Article 9. Instead, the funds will be classified as Article 8, referring to the EU’s less stringent ESG fund classThe decision affects close to €45 billion ($46 billion) of Amundi’s Article 9 productsA DWS spokesperson said its downgrades will impact about €2 billion of fund assetsMorningstar said it expects that at least $85 billion of industrywide Article 9 funds will be downgraded in the coming weeks and months“We expect many, if not all, of what we call ‘climate conscious’ and ‘low carbon’ funds to shift from Article 9 to Article 8,” said Hortense Bioy, Morningstar’s global director of sustainability research"
2022-11-21,Amundi Joins Growing List of Firms Downgrading Funds,"Amundi, Europe’s largest asset manager, is removing the region’s highest ESG designation from virtually all funds that have it, as the firm tries to interpret changes in regulatory guidelines. Due to the “still evolving regulatory environment,” Amundi has opted to take “a conservative approach” and reclassify “almost all of its range” of funds listed under the EU’s highest ESG category, known as Article 9, an Amundi spokesperson saidInstead, the funds will be classified as Article 8, the spokesperson said, referring to the EU’s less stringent ESG fund classAmundi is the latest in a growing list of investment firms impacted by changes to the EU’s anti-greenwash rulebook, the Sustainable Finance Disclosure RegulationIntended as a global gold standard for ESG investing, the framework has been tainted by seemingly endless gaps and inconsistencies that have caught out firms including BlackRock, Axa Investment Management and Pimco"
2022-11-21,COP27 Approves Last-Ditch Historic Climate Deal,"The COP27 climate talks in Egypt, which came close to collapse in the closing stretches, ended with an early-hours deal to create a fund to pay poorer countries for the harm caused by climate change. The agreement on loss and damage is a landmark moment in global climate politics  an acknowledgment that richer nations are responsible to the developing world for the harm caused by rising temperaturesBut the fractious summit, which took place against the background of a global energy crisis sparked by Russia’s invasion of Ukraine, exposed fault lines on how the world should navigate the transition away from fossil fuelsAnd it did little to advance the ambitions of last year’s COP in Glasgow to rein in harmful greenhouse gas emissions"
2022-11-17,SLB Issuers Find Themselves Facing Possible Penalties,"The revival of fossil fuels in European energy policy risks triggering the first wave of financial penalties in the global market for ESG bonds. A test case is about to unfold in Greece, where energy supplier Public Power Corp. may find it “virtually impossible” to meet the end-of-year emissions target on some of its debt, according to an analysis conducted by the Anthropocene Fixed Income InstituteThat’s as regulators, government officials and industry representatives agree on crisis policies that are delaying the company’s phaseout of lignite coal production, which also may make it challenging to meet a separate 2023 target, AFII saidThe debt in question is a sustainability-linked bond. SLBs typically see issuers pay a penalty if they miss pre-determined ESG goals. But with Europe’s decision to ramp up coal production in response to the current energy crisis, near-term climate commitments are being derailed and leaving many utilities with little choice but to adapt"
2022-11-16,FAANG-Related Bets May Do More Harm Next Year,"ESG investors holding so-called FAANG stocks with the hope that 2023 will right some of this year’s wrongs may be in for a nasty surprise. Facebook parent Meta Platforms, Amazon.com, Apple, Netflix and Google parent Alphabet dominate some of the biggest ESG funds and are a big reason they’ve underperformed this yearIn the past 12 months, the MSCI World Information Technology Index fell about 25%, with Amazon down more than 45% and Meta losing about two-thirds of its valueThose losses may not be the end of the bad streak. “We could potentially see a continuation of some of the issues that we’ve had in the tech sector next year,” Amarachi Seery, a sustainability analyst at Janus Henderson"
2022-11-15,Battery Storage Tops List for Climate-Tech Investors,"At least $369 billion. That’s the amount of money made available to bolster clean energy from the landmark Inflation Reduction Act. And investors are circling. Opportunities range from renewable and nuclear energy to electric vehicles and newer technologies such as batteries, hydrogen and carbon capture, utilization and storageThe battery-storage market was picked as the sector with the most potential in a  News survey of Terminal and .com readersRoughly 27% of the 691 respondents picked battery storage as their top pick. Solar and wind companies placed second at 18%, followed by green hydrogen, carbon capture and EV manufacturers	It’s official: The supply chain for electric-vehicle batteries is coming to America"
2022-11-14,"Amazon, Meta Cut Thousands of Jobs as Business Slows","Tech companies are trimming staff and slowing hiring as they face higher interest rates and sluggish consumer spending in the US and a strong dollar abroad.  The tech industry shed 9,587 jobs in October, the highest monthly total since November 2020, according to Challenger, Gray & ChristmasJob losses follow recent earnings reports from Alphabet, Amazon.com, Meta Platforms, Microsoft Corp. and others fell short of projections, sending shares plunging and shaving hundreds of billions of dollars from their market valuationsMeta, for instance, has lost more than 67% of its value so far this year"
2022-11-13,HSBC Boss Finds Himself on His Own at COP27,"The room was cramped, the microphone unsteady and HSBC Holdings’s Noel Quinn was the only major bank CEO there. Wednesday was Finance Day at COP27 in Sharm El-Sheikh, Egypt, when the UN climate talks shifted from discussing carbon dioxide in the air and ravaged communities and ecosytems on the ground to the dollars in bank accounts and investment portfolios that can be put to work to fund the transition to clean energyThe contrast to the same event just a year ago in Glasgow couldn’t have been greater. Unlike 2021, Quinn didn’t have the company of fellow big name CEOs such as Larry Fink of BlackRock, Bill Winters of Standard Chartered or Jane Fraser of CitigroupThe tone of the conversation also was also different from a year ago. Instead of dropping headline-grabbing announcements, panelists discussed the dry and unglamorous details of how to actually deliver on their commitments and what it means in practice for a bank or asset manager to eliminate their financed emissionsQuinn centered his comments on corporate transition plans. He said it was time to focus on the “science-based underpinning” behind corporate decarbonization proposals. He talked of forcing firms to “make clear how they’re going to change their capital investment,” what that means for individual sectors, and how progress might be measured"
2022-11-10,Funds Seen Lagging Behind Broader Markets in 2023,"The debate over whether investing with ESG principles in mind makes money is one that’s grown in recent years as the global market for sustainable funds has ballooned to more than $2.2 trillion. Market data show that the average equity fund adhering to ESG factors has lost slightly less money this year than products that track vanilla benchmark indexes such as the S&P 500Over the longer term record, about 56% of US sustainable funds beat rival category groups in the three-year period ended Sept. 30, according to researchers at MorningstarThat isn’t swaying opinions, at least for next year. In a  News survey of terminal and .com readers, 65% of the respondents expect ESG funds to trail the broader market in 2023Of the 691 respondents, 264 expect ESG funds to “slightly underperform” and 184 are predicting they’ll “significantly underperform”"
2022-11-09,China Property Rout Imperils $1.6 Trillion of Debt,"China’s deepening property crisis is piling pressure on a $1.6 trillion corner of the country’s onshore bond market, as cities and local administrations step in to bail out troubled developers in a state-backed bid to aid the sector. After replacing builders as the biggest buyers of land earlier this year, the nation’s so-called local government financing vehicles, or LGFVs, have now become the main purchasers of half- finished projects of defaulters, including China Evergrande Group. Their increasing involvement in real estate has analysts raising red flagsMoody’s Investors Service said that may weigh on the credit profile of these state funding agenciesWhile no LGFV has defaulted in the current cycle,  Economics isn’t ruling out one ahead, as its data show average credit spreads on some of the worst-performing LGFV local bonds have almost doubled to almost 10 percentage points since mid-January"
2022-11-08,"Blackstone, Pimco Stay Out of Net-Zero Finance Group","Even after easing its terms, the world’s largest climate-finance coalition has failed to draw in some of the giants of investing. The Glasgow Financial Alliance for Net Zero is heading into the COP27 climate summit in Egypt having agreed to let signatories avoid binding restrictions on fossil finance. The concession, which drew condemnation from climate activists, coincided with a GFANZ announcement that it attracted an extra 100 members during the past yearGFANZ co-chair, Mark Carney, recently said that instead of criticizing members for not doing enough, it’s time to focus on holdoutsThe list includes some of the biggest names in global finance, including Blackstone, Carlyle Group and Pacific Investment Management"
2022-11-07,Corporate Chiefs Rail Against Cluture of Box-Ticking,"Company directors are becoming increasingly frustrated with institutional investors and the proxy agencies that guide them, according to a survey of FTSE 100 chairs. Participants in the UK report include chairs such as Douglas Flint of Abrdn, Mark Tucker of HSBC Holdings, Stuart Rose of Asda Stores and Cressida Hogg of Land Securities GroupThe chairs said the proliferation of ESG rules was excessive and resulted in a culture of box-ticking. One likened ESG reporting to the Wild West due to differing standards and a lack of clarityOne of those surveyed said that “quite often institutions hide behind the proxy agencies, who themselves speak about the ecosystem they represent but don’t actually engage themselves”"
2022-11-06,BlackRock’s Political Spending Climbs to Record High,"BlackRock is pouring record amounts of money into US political campaigns this year as the asset-management giant faces mounting scrutiny over its size and advocacy of sustainable investing. The company’s political action committee contributed about $647,000 to congressional candidates, their leadership PACs and political parties between January 2021 and the middle of October, according to the most recent public records before the midterm elections on Nov. 8That’s about 38% more than the committee gave in the 2020 election cycle, and slightly more than half the sum, $331,000, has gone to Democrats so far this electionBlackRock and CEO Larry Fink are at the center of an escalating political battle over ESG-related investingRepublican politicians have attacked ESG for harming fossil-fuel interests and advancing societal causes above financial returns, while some Democrats and environmental advocates have criticized the firm for not doing more to combat climate change"
2022-11-02,Vanguard Plans to Give Clients More Say on Voting,"Vanguard Group is planning a trial to give retail clients more say over how their shares are voted at corporate meetings, as large money managers’ influence over hot-button issues faces mounting scrutiny. Instead of making decisions exclusively on its own, Vanguard will give individual investors in several equity index funds more options about how their shares are votedVanguard will begin testing the strategy early next year“This early 2023 pilot will give our investors-owners the chance to express their preferences for how the underlying shares of their equity index holdings are voted,” said Anne Robinson, Vanguard’s general counselThe trial will likely offer investors additional voting options such as following company management recommendations, opting not to vote or choosing to rely on guidance from a third party"
2022-11-01,Billions Chasing Funds Leave Insiders ‘Mystified’,"As an ESG fund class facing mass downgrades attracts vast client flows, industry insiders confess they don’t understand why investors aren’t being more cautious. The fund class in question is called Article 9  Europe’s top ESG disclosure designationThe problem is that analysts, industry associations and lawyers advising fund managers acknowledge that a significant number of Article 9 funds don’t currently meet the EU’s strict sustainability requirementsDozens of funds have already lost their Article 9 tag, including offerings from Pimco and Goldman Sachs’s NN Investment PartnersDespite the cloud hanging over Article 9, the fund class drew almost €13 billion ($13 billion) in client flows in the third quarter, bringing the total over the first nine months of this year to €29 billion, Morningstar data show"
2022-10-31,Bankers Meet in Hong Kong Amid Growing China Tensions,"Some of the biggest names on Wall Street are descending on Hong Kong in their first trip since the pandemic began, defying criticism by US lawmakers amid growing tensions with China. Goldman Sachs’ David Solomon, Morgan Stanley’s James Gorman and Blackrock’s Rob Kapito will be among the 200 or so attendees at the Global Financial Leaders’ Investment Summit, which starts TuesdayThe three-day event comes as ties between the US and China worsen, with the world’s two largest economies sparring in recent months over trade, human rights and Beijing’s aggressive moves against TaiwanChinese President Xi Jinping’s yearlong crackdown on private enterprise and the property market has sharply undermined investor confidence in the nation’s assetsThe stakes are especially high for global financial institutions. Many banks and asset managers have been on an investment and hiring spree in mainland China and Hong Kong in recent years as the world’s second-biggest economy opened its $60 trillion financial market“Foreign banks are still keen to do business or explore opportunities in mainland China and Hong Kong,” said Lloyd Chan, senior economist at Oxford Economics. “However, banks will still have to grapple with a business environment that continues to be uncertain and challenging, as strained relations between US and China imply economic and financial risks”"
2022-10-30,Goldman Among Managers Warning of Investment Overhaul,"A lot of ESG bets that once looked good no longer do. Luke Barrs, managing director and global head of fundamental equity client portfolio management at Goldman Sachs Asset Management, said “people are having to reassess holistically how they think about ESG integration”Just 18 months ago, a company in an ESG portfolio “could effectively burn cash for a number of years” to build up scale, “and there wasn’t a need to be cash- flow positive in the near term,” he said. That world “has kind of disappeared”After a year shaped by war, an energy crisis, decades-high inflation and rapidly rising interest rates, the world in which ESG investing got its foothold has been replaced by something far less hospitableFor fund managers “trying to build a holistic approach to assessing and integrating ESG into your portfolio, there has had to be some reassessment,” he said"
2022-10-27,Asset Managers May Soon Face Wave of Fund Downgrades,"Asset managers may need to downgrade hundreds of ESG funds in the coming months, as they struggle to land on the right side of European regulations. Such a development would mark a significant escalation and cast serious doubts over ESG designations across the investment management industryMore than 40 funds were re-classified last quarter from Article 9  the top disclosure category within the EU’s ESG investing rules  to a less stringent ESG category known as Article 8, according to Morningstar. That follows 16 downgrades in the second quarter“It’s hard to predict how many Article 9 funds will be downgraded in total,” said Hortense Bioy, Morningstar’s global director of sustainability research. “There indeed could be hundreds in the next six months”"
2022-10-26,Fund Rules Draw Criticisms From European Regulators,"The world’s most far-reaching set of ESG investment rules is facing a wave of criticism as regulators in Britain and the European Union publicly voice their misgivings. The UK’s Financial Conduct Authority has deliberately steered clear of some of the main features of Europe’s Sustainable Finance Disclosures Regulation, after it became clear they resulted in an ESG “contest” among fund managers rather than an exercise in transparency, said Sacha Sadan, the FCA’s director of environmental, social and governanceThose comments coincided with a warning from Europe’s markets watchdog, whose head publicly urged EU officials to address the “real challenge” posed by the the bloc’s ESG rulesAmong concerns voiced by the EU’s markets regulator is the lack of clarity in regulations when it comes to basic ESG concepts such as a “sustainable investment”“Navigating through the many different products and offerings and understanding the differences in terms of sustainability remains extremely difficult,” Verena Ross, chair of the European Securities and Markets Authority, in a speech published on Oct. 24."
2022-10-25,New Venture Fund Focuses on Ocean Climate Tech,"A new $100 million venture fund is teaming up with one of the world’s leading marine research institutes to invest exclusively in ocean technologies aimed at addressing the climate crisis. Boston-based Propeller will focus on startups developing tech to remove carbon dioxide from the ocean, decarbonize shipping and improve efficiency in marine industries, among other innovationsThe firm also will invest in companies looking to tap ocean microbes and other organisms to produce energy, pharmaceuticals and other productsWhen it comes to mitigating climate change, “the ocean is doing most of the heavy lifting already,” said Brian Halligan, founder and partner at PropellerThe ocean produces 50% of the planet’s oxygen and absorbs about a third of the carbon dioxide produced from the burning of fossil fuels. But little of the billions of dollars investors have poured into climate technologies has been devoted to ocean-related solutions"
2022-10-24,Deutsche Bank Says Fund Market Enters ‘Phase Three’,"First, no one had heard of it. Then everybody was touting it. Now, people are rethinking what it is. Environmental, social and governance investing has entered “Phase 3,” said Markus Müller, chief investment officer for ESG at Deutsche Bank’s private banking arm“With Phase 3, we are likely to have both consolidation and reorientation in ESG investing,” he said. “I don’t think that investors will materially reduce or stop allocations to ESG as they wait for better information, but they will continue to reassess and reorient investment approaches”The big game-changer for ESG this year has been the energy crisis. Fund managers who weren’t exposed to energy assets are now regrouping to make sure they don’t get wrong-footed againMüller points to the huge gains ESG investors have missed out on by snubbing oil and gas assets, with the S&P 500 Energy Index up more than 50% this year, while the broader S&P index is down almost 20%"
2022-10-23,Mystery Trades See Record Outflow From Biggest ETF,"The biggest outflow on record from a $19 billion exchange-traded fund is fueling speculation that BlackRock is shuffling its model-portfolio allocations.   Roughly $1.2 billion was pulled Thursday from the iShares ESG Aware MSCI USA ETF (ticker ESGU), the biggest socially-conscious investing ETF. It marked the fund’s biggest one-day outflow ever, according to data compiled by The abruptness and magnitude of the redemptions make it look like a model-portfolio tweak, according to  Intelligence’s Athanasios PsarofagisSuch off-the-shelf strategies, which usually package together ETFs and mutual funds, have boomed in popularity with financial advisers and their clients, and are estimated to hold trillions of dollars. As a result, allocation decisions can make a big splash in day-to-day ETF flowsIn response to questions, BlackRock provided what’s called its model-portfolio commentary that it shared with financial advisers. Without singling out any funds, the firm wrote that “consistent with the trajectory of our last several rebalances, we are again shrinking exposure to overall risk and pulling back on existing active views, inching closer to benchmark in almost all respects”"
